Magnum,magnum,623d9555a6e491964c6ab9bc,624ff5c1122574a9cfb713d0,Fri Apr 08 2022 08:43:45 GMT+0000 (Coordinated Universal Time),Thu May 26 2022 20:31:07 GMT+0000 (Coordinated Universal Time),Thu May 26 2022 20:48:57 GMT+0000 (Coordinated Universal Time),Магнум,hamovniki,soboleva-svetlana,0,825 000,70 122 000,"Усачёва ул., 9",ЦАО,м. Фрунзенская,https://api-maps.yandex.ru/services/constructor/1.0/js/?um=constructor%3A55ea2cc7ba895b873e0e762f6a0ec82d6cf18d503a3435fd5a1acf6076f2a9ea&amp;width=100%25&amp;height=400&amp;lang=ru_RU&amp;scroll=true,От 55 до 216,44,55,216,"Magnum Opus — «великое дело», главный труд жизни. ","<p><strong>Проект «Magnum»</strong> — это клубный дом высотой в 6 этажей. Облицовка фасада — высококачественный эталонный кирпич и система вентилируемых фасадов. Дизайнерская отделка общественных зон выполнена по индивидуальному проекту с применением натурального камня, ценных пород дерева и бронзы. В доме установлены просторные бесшумные лифты ThyssenKrupp с индивидуальной отделкой лифтовых кабин.</p><p>В клубном доме «Magnum» всего 40 апартаментов с зимними садами, площадью от 54 до 198 кв. метров, и 4 пентхауса с зимними садами и открытыми террасами. Апартаменты сдаются без стен и высотой потолков от 3,43 до 3,85 метров, также предусмотрены панорамные окна системы Schueco с повышенной шумоизоляцией.</p><p>Территория комплекса «Magnum» охраняемая, на ней ведется круглосуточное видеонаблюдение и установлена система контроля доступа. Для владельцев автомобилей предусмотрен двухуровневый подземный &nbsp;паркинг.</p><p>Проект «Magnum» находится в районе Хамовники. Всего в 200 метрах расположен парк Усадьба Трубецких. </p>",Новостройки,https://uploads-ssl.webflow.com/620e15709e3fbe1a70764578/624ff51ad2dfd44def7e4b12_82e27bb0cf767b939a9aeb80efe1175a-min.jpg,https://uploads-ssl.webflow.com/620e15709e3fbe1a70764578/624ff51ec053b17f47d71d56_b50521d6f03188f25b4330de7a450bb7-min.jpg,https://uploads-ssl.webflow.com/620e15709e3fbe1a70764578/628fe3885f80108bcc4a0c0a_MAGNUM.svg,https://uploads-ssl.webflow.com/620e15709e3fbe1a70764578/624ff59c049059cc735ab2d9_%D0%9F%D1%80%D0%B5%D0%B7%D0%B5%D0%BD%D1%82%D0%B0%D1%86%D0%B8%D1%8F_compressed.pdf,https://uploads-ssl.webflow.com/620e15709e3fbe1a70764578/624ff52ae426174140221dc9_bb620191d44383facca00862b1cb80ac-min.jpg; https://uploads-ssl.webflow.com/620e15709e3fbe1a70764578/624ff52a70ba2fed6d4f6071_32a9c49bcfa79ee05040c7d0a73c20c1-min.jpg; https://uploads-ssl.webflow.com/620e15709e3fbe1a70764578/624ff52af796eb0cff351762_3cf7d040dbc00cc7f704586cfbeaa096-min.jpg; https://uploads-ssl.webflow.com/620e15709e3fbe1a70764578/624ff58dfb05b9080ba0a14b_%D0%A1%D0%BD%D0%B8%D0%BC%D0%BE%D0%BA%20%D1%8D%D0%BA%D1%80%D0%B0%D0%BD%D0%B0%202022-04-08%20%D0%B2%2011.41.55-min.png; https://uploads-ssl.webflow.com/620e15709e3fbe1a70764578/624ff585a2cd9950fd16104e_%D0%A1%D0%BD%D0%B8%D0%BC%D0%BE%D0%BA%20%D1%8D%D0%BA%D1%80%D0%B0%D0%BD%D0%B0%202022-04-08%20%D0%B2%2011.42.16-min.png,
Меценат,mecenat,623d9555a6e491964c6ab9bc,623d9555a6e491659d6aba09,Wed Mar 23 2022 16:43:12 GMT+0000 (Coordinated Universal Time),Wed Jul 13 2022 18:27:32 GMT+0000 (Coordinated Universal Time),Wed Jul 13 2022 18:35:26 GMT+0000 (Coordinated Universal Time),,yakimanka,soboleva-svetlana,0,1 085 421,90 090 000 ,"2-й Кадашевский переулок, д.3 стр. 1",ЦАО,м. Третьяковская,https://api-maps.yandex.ru/services/constructor/1.0/js/?um=constructor%3Acfb77e3365f47670976afc7ff716729a8ca010b7cd0e3ab6849c72fd1ba711d4&amp;width=100%25&amp;height=400&amp;lang=ru_RU&amp;scroll=true,от 83 до 430,36,83,430,КОМПЛЕКС КЛУБНЫХ ОСОБНЯКОВ В ЦЕНТРЕ МОСКВЫ,"<p>Клубный квартал «Меценат» в самом сердце Москвы – престижном и уютном районе Якиманка. Приватный квартал состоит из 9 особняков: 24 квартиры, двухуровневые лоты со вторым светом и выходом в сад, 9 таунхаусов и 3 двухэтажных дома с каминами. </p><p>В квартале сохранен фрагмент фабрики XIX века и исторический особняк полностью, новые строения стилизованы под архитектуру позапрошлого века. </p><p>Фасады с карнизами, цоколем и металлическими балконами, с отделкой из кирпича ручной формовки из Великобритании. </p><p>Авторский проект отделки интерьеров мрамором и декоративной штукатуркой от Ильи Уткина. Приватный парк с зелёными насаждениями, декоративными растениями обустроен зонами отдыха и детской игровой площадкой для юных жителей.</p>",Новостройки,https://uploads-ssl.webflow.com/620e15709e3fbe1a70764578/625352e4aff0152d4b22b5fe_nju.jpg,https://uploads-ssl.webflow.com/620e15709e3fbe1a70764578/623f5e9429f36947db242b74_%D0%A1%D0%BD%D0%B8%D0%BC%D0%BE%D0%BA%20%D1%8D%D0%BA%D1%80%D0%B0%D0%BD%D0%B0%202022-03-26%20%D0%B2%2021.41.59-min.png,https://uploads-ssl.webflow.com/620e15709e3fbe1a70764578/623b4dfa29a3ac4b8c17fba2_llg-min.png,https://uploads-ssl.webflow.com/620e15709e3fbe1a70764578/623b4dec5d79592b6591056d_rooms_compressed.pdf,https://uploads-ssl.webflow.com/620e15709e3fbe1a70764578/623f5e54c55a47db02926d77_%D0%A1%D0%BD%D0%B8%D0%BC%D0%BE%D0%BA%20%D1%8D%D0%BA%D1%80%D0%B0%D0%BD%D0%B0%202022-03-26%20%D0%B2%2021.39.03-min.png; https://uploads-ssl.webflow.com/620e15709e3fbe1a70764578/623f5e5d3a9f2e7c7abe1df1_%D0%A1%D0%BD%D0%B8%D0%BC%D0%BE%D0%BA%20%D1%8D%D0%BA%D1%80%D0%B0%D0%BD%D0%B0%202022-03-26%20%D0%B2%2021.39.19-min.png; https://uploads-ssl.webflow.com/620e15709e3fbe1a70764578/623f5e5d6b70a733f9ea67a0_%D0%A1%D0%BD%D0%B8%D0%BC%D0%BE%D0%BA%20%D1%8D%D0%BA%D1%80%D0%B0%D0%BD%D0%B0%202022-03-26%20%D0%B2%2021.39.45-min.png; https://uploads-ssl.webflow.com/620e15709e3fbe1a70764578/623f5e5d8e4876571c6cc6e3_%D0%A1%D0%BD%D0%B8%D0%BC%D0%BE%D0%BA%20%D1%8D%D0%BA%D1%80%D0%B0%D0%BD%D0%B0%202022-03-26%20%D0%B2%2021.40.03-min.png; https://uploads-ssl.webflow.com/620e15709e3fbe1a70764578/623f5e5c54308ef3f3081b7a_WhatsApp%20Image%202022-02-18%20at%2013.36.06-min.jpeg,
Nabokov,nabokov,623d9555a6e491964c6ab9bc,624ff7f8734bc9f21975d2d4,Fri Apr 08 2022 08:53:12 GMT+0000 (Coordinated Universal Time),Wed Jul 13 2022 18:24:15 GMT+0000 (Coordinated Universal Time),Wed Jul 13 2022 18:35:26 GMT+0000 (Coordinated Universal Time),Набоков,hamovniki,soboleva-svetlana,0,1 720 000 ,203 648 000 ,Курсовой переулокд. 10,ЦАО,м. Кропоткинская ,https://api-maps.yandex.ru/services/constructor/1.0/js/?um=constructor%3A2b46250646cdb79f82e9d8ee41a028d7e15923d3e75694bad418fede519a80bd&amp;width=100%25&amp;height=400&amp;lang=ru_RU&amp;scroll=true,От 120 до 500,15,120,500,Nabokov – 6-этажный клубный дом в стиле сдержанного минимализма на «Золотой миле». ,"<p>В доме 15 апартаментов &nbsp;с авторской отделкой от английской дизайн-студии AukettSwanke. </p><p>На верхнем этаже пентхаус с просторной террасой, из окон которого открывается великолепный вид на тихие переулки Остоженки и Храм Христа Спасителя. </p><p>Фасад дома выполнен из светлого юрского мрамора с панорамными окнами. Особая кладка длинными брусками создает ощущение бархатистой фактуры. </p><p>Архитекторы проекта «Цимайло Ляшенко &amp; Партнеры». </p><p>Парадную галерею резиденции оформили натуральным камнем, ценными породами дерева, стеклянными элементами и бронзой. </p><p>Для жителей предусмотрен подземный паркинг на 32 автомобиля.</p><p>‍</p>",Новостройки,https://uploads-ssl.webflow.com/620e15709e3fbe1a70764578/624ff72f4ee38ad20e987a7d_Nabokov%20facade%202-min.jpg,https://uploads-ssl.webflow.com/620e15709e3fbe1a70764578/624ff739122574f2c4b7190d_Nabokov%20facade%208-min.jpg,https://uploads-ssl.webflow.com/620e15709e3fbe1a70764578/629868a8557994d6f543793c_NABOKOV.svg,https://uploads-ssl.webflow.com/620e15709e3fbe1a70764578/624ff6fff951fa850a3b90de_2021-06-29_Nabokov%20%D0%BF%D1%80%D0%B5%D0%B7%D0%B5%D0%BD%D1%82%D0%B0%D1%86%D0%B8%D1%8F%20full_compressed.pdf,https://uploads-ssl.webflow.com/620e15709e3fbe1a70764578/624ff764621583701f011bb6_Nabokov%20facade%205-min.jpg; https://uploads-ssl.webflow.com/620e15709e3fbe1a70764578/624ff76ce426174dc0222eec_Nabokov%20facade%203-min.jpg; https://uploads-ssl.webflow.com/620e15709e3fbe1a70764578/624ff7672a16a17c6d2e45ea_Nabokov%20interior%20concept%20(3)-min.JPG; https://uploads-ssl.webflow.com/620e15709e3fbe1a70764578/624ff76eb1374233352195e4_Nabokov%20interior%204-min.jpg; https://uploads-ssl.webflow.com/620e15709e3fbe1a70764578/624ff7653b9bc79951348c3b_Nabokov%20interior%20concept%20(5)-min.JPG,6
Поклонная 9,poklonnaya-9,623d9555a6e491964c6ab9bc,625048bb012e6c137e551adf,Fri Apr 08 2022 14:37:47 GMT+0000 (Coordinated Universal Time),Wed Jul 13 2022 18:25:32 GMT+0000 (Coordinated Universal Time),Wed Jul 13 2022 18:35:26 GMT+0000 (Coordinated Universal Time),,dorogomilovo,soboleva-svetlana,0,863 085 ,44 103 644,"Поклонная ул., д. 9",ЗАО,м. Парк Победы,https://api-maps.yandex.ru/services/constructor/1.0/js/?um=constructor%3A1ec2206524d47487ab45a8a2dc712a12ff34bbcfd1327726579422faca6921ce&amp;width=100%25&amp;height=400&amp;lang=ru_RU&amp;scroll=true,От 48 до 482,493,48,482,32-этажное здание в стиле московских высоток и небоскребов Нью-Йорка,"<p><strong>Проект «Поклонная 9</strong>» — это 32-этажное здание в стиле московских высоток и небоскребов Нью-Йорка. Дом построен по долговечной кирпично-монолитной технологии. Стены здания облицованы навесным вентилируемым фасадом из керамогранита.</p><p>Проект «Поклонная 9» разделен на несколько «уровней» — с &nbsp;8 по 28 этаж запроектированы апартаменты площадью от 49 до 176 кв. метров, а два верхних этажа занимают пентхаусы с террасами. В апартаментах представлены панорамные окна и окна в ванной, полы с подогревом, камины, система очистки воды до питьевого уровня и повышенная шумоизоляция.</p><p> На первых семи этажах жителям доступна инфраструктура пятизвездочного отеля: фитнес-клуб, spa, массажные кабинеты, панорамный бассейн, магазины, рестораны, фудмаркет, коворкинг, лаунж-зоны, конференц-центр. Для владельцев автомобилей предусмотрен подземный паркинг на 234 места.</p><p>ЖК находится в районе Дорогомилово. Инфраструктура района развита, в пешей доступности: центр детского творчества, школы, магазины, детские сады, кафе, поликлиники. До Триумфальной арки всего 500 метров, а метро «Парк Победы» находится в 10 минутах.</p>",Новостройки,https://uploads-ssl.webflow.com/620e15709e3fbe1a70764578/625048a070ba2f55bd521c69_db003d88026392027ef55c3a91deffbf-min.jpg,https://uploads-ssl.webflow.com/620e15709e3fbe1a70764578/625048a5f3c9b8482d4f4b56_83ea468550bdff3d556e10857714184a-min.jpg,https://uploads-ssl.webflow.com/620e15709e3fbe1a70764578/62973435f2e739c4fea06838_%D0%9F%D0%BE%D0%BA%D0%BB%D0%BE%D0%BD%D0%BD%D0%B0%D1%8F_9.svg,https://uploads-ssl.webflow.com/620e15709e3fbe1a70764578/6250485474f84bd929452f96_%D0%9F%D1%80%D0%B5%D0%B7%D0%B5%D0%BD%D1%82%D0%B0%D1%86%D0%B8%D1%8F.pdf,https://uploads-ssl.webflow.com/620e15709e3fbe1a70764578/625048ae18e50a92868b5cb8_7c5c9b0fcc62d7e2f56b7ed5ec0246f5-min.jpg; https://uploads-ssl.webflow.com/620e15709e3fbe1a70764578/625048af0ad1b5afaa4cc352_7f985c37945c83d7b0934b27f511a809-min.jpg; https://uploads-ssl.webflow.com/620e15709e3fbe1a70764578/625048aea862c008a6a1077f_8159a36cd940e17eeef3dc9551351848-min.jpg; https://uploads-ssl.webflow.com/620e15709e3fbe1a70764578/625048af6210b926090faa21_e701d31ac86f043c51e8e19f1559e35a-min.jpg; https://uploads-ssl.webflow.com/620e15709e3fbe1a70764578/625048af732bcad9c9830724_6c74591e54db95d88173aab19ea69c3d-min.jpg,2
Пречистенка 8,prechistenka-8,623d9555a6e491964c6ab9bc,625dee408ef6ca540687eef6,Mon Apr 18 2022 23:03:28 GMT+0000 (Coordinated Universal Time),Wed Sep 07 2022 19:22:56 GMT+0000 (Coordinated Universal Time),Wed Sep 07 2022 19:23:07 GMT+0000 (Coordinated Universal Time),,hamovniki,soboleva-svetlana,0,1 850 000,по запросу,"Пречистенка, д. 8",ЦАО,м. Кропоткинская,https://api-maps.yandex.ru/services/constructor/1.0/js/?um=constructor%3Af2dc2fed8fa3fc47b61d88da11d15f27bbb5b239c6ab75ba9466b9819aa6d82b&amp;width=100%25&amp;height=400&amp;lang=ru_RU&amp;scroll=true,от 125 до 207,6,125,207,«Продается подлинник Пречистенка 8»,"<p>Жилой комплекс «Пречистенка 8» – клубный дом в историческом центре Москвы, где сохранилась подлинно московская архитектура, а в окрестностях расположились главные музеи и парки столицы, Москва-река и бульварное кольцо.</p><p>История этого дома завораживает. Атмосфера и уникальный характер особняка в центре столицы основаны на уважении к русской культуре и продолжении традиций. Интерьеры «Пречистенки 8» созданы для того, чтобы проживать каждый момент и чутко слышать себя. Открывая новую главу в городской жизни.</p><p>«Пречистенка 8» — дом XVIII века, современный интерьер которого наполнен уникальными историческими деталями. Двухстворчатые высокие двери, художественный паркет, лепнина на потолках, камины и мраморные подоконники были бережно сохранены, а предметы интерьера эпохи mid-centurymodern дополнили самобытность атмосферы. Технологичные решения нашего века были интегрированы в пространство без нарушения его аутентичной атмосферы.</p>",Новостройки,https://uploads-ssl.webflow.com/620e15709e3fbe1a70764578/625dee15f9bf32012e1b00f6_6.jpg,https://uploads-ssl.webflow.com/620e15709e3fbe1a70764578/625dee18f01cea710694193e_1.jpg,https://uploads-ssl.webflow.com/620e15709e3fbe1a70764578/628fe0cc28110f8f55ab9e94_%D0%9F%D0%A0%D0%95%D0%A7%D0%98%D0%A1%D0%A2%D0%95%D0%9D%D0%9A%D0%90%208.svg,,https://uploads-ssl.webflow.com/620e15709e3fbe1a70764578/625dee18f01cea710694193e_1.jpg; https://uploads-ssl.webflow.com/620e15709e3fbe1a70764578/625dee26e07aaf3a9a0a8b2a_2.jpg; https://uploads-ssl.webflow.com/620e15709e3fbe1a70764578/625dee26316d7c40d249b5a5_3.jpg; https://uploads-ssl.webflow.com/620e15709e3fbe1a70764578/625dee24e07aaf19930a8b20_4.jpg; https://uploads-ssl.webflow.com/620e15709e3fbe1a70764578/625dee254c2d9d1ca7b0bf0d_5.jpg,0
Prime Park ,prime-park,623d9555a6e491964c6ab9bc,624ffcc696348007d2ab335b,Fri Apr 08 2022 09:13:42 GMT+0000 (Coordinated Universal Time),Wed Sep 07 2022 20:15:08 GMT+0000 (Coordinated Universal Time),Wed Sep 07 2022 20:15:26 GMT+0000 (Coordinated Universal Time),Прайм Парк,horoshovskiy,soboleva-svetlana,0,по запросу,по запросу,"Ленинградский просп., 37/5",ЦАО,м. Петровский парк ,https://api-maps.yandex.ru/services/constructor/1.0/js/?um=constructor%3A169e662c347e0ca6b166ffe46da09ee589ef284615b918cbd44d95c2315b6b00&amp;width=100%25&amp;height=400&amp;lang=ru_RU&amp;scroll=true,От 40 до 153,0,40,153,"В комплексе открыли рестораны, кафе и магазины, а также фитнес-клуб с бассейном для резидентов. ","<p>Жилой комплекс премиум-класса с квартирами в Хорошевском районе. </p><p>Комплекс состоит из девяти корпусов от 20 до 42 этажей, объединенных четырьмя ландшафтными парками площадью 3 гектара с зонами отдыха, фонтанами, игровыми и спортивными площадками. </p><p>В комплексе открыли рестораны, кафе и магазины, а также фитнес-клуб с бассейном для резидентов. </p><p>Около стойки консьержа, который дежурит круглосуточно, расположена лаунж-зона с диванами и столиками, где можно провести деловую встречу или встретиться с друзьями. </p><p>В комплексе предусмотрен подземный паркинг с автомойкой и распознаванием номеров.</p><p>квартиры от 500 000 рублей за м2.</p><p>Комнаты от 1 до 5.</p><p>Площадь от 40 до 153 м2.</p>",Новостройки,https://uploads-ssl.webflow.com/620e15709e3fbe1a70764578/624ffc8cf951fa88db3bc23a_DJI_0860-HDR-min.jpg,https://uploads-ssl.webflow.com/620e15709e3fbe1a70764578/624ffc8ff796eb64c43540cd_DJI_0472-%D0%9F%D0%B0%D0%BD%D0%BE_1-min.jpg,https://uploads-ssl.webflow.com/620e15709e3fbe1a70764578/628e0d8f99fd7a05c0d11a86_PRIME%20PARK.png,https://uploads-ssl.webflow.com/620e15709e3fbe1a70764578/624ffb8df951fa13af3bb921_presentation-Prime-Park_compressed.pdf,https://uploads-ssl.webflow.com/620e15709e3fbe1a70764578/624ffc9c70ba2f64cf4f974c_6781_dyergroup_primepark_exterior_06-min.jpg; https://uploads-ssl.webflow.com/620e15709e3fbe1a70764578/624ffc9cc788e50c654673dc_6781_dyergroup_primepark_exterior_09-min.jpg; https://uploads-ssl.webflow.com/620e15709e3fbe1a70764578/624ffc9c75090f76b0c12351_6780_dyergroup_primepark_pilot_park_031-min.jpg; https://uploads-ssl.webflow.com/620e15709e3fbe1a70764578/624ffc9b3795a9515ff82d56_6781_dyergroup_primepark_interior_bedroom_02-min.jpg; https://uploads-ssl.webflow.com/620e15709e3fbe1a70764578/624ffc9b0b137a8680e66fee_8_in-min.jpg,5
RiverResidences,riverresidences,623d9555a6e491964c6ab9bc,623f72698e487673b06d44ad,Sat Mar 26 2022 20:07:05 GMT+0000 (Coordinated Universal Time),Wed Jul 13 2022 04:54:42 GMT+0000 (Coordinated Universal Time),,Ривер Резеденция,strogino,soboleva-svetlana,,от 1 000 000 ,,"Таманская ул., 1",СЗАО,м. Октябрьское поле ,https://api-maps.yandex.ru/services/constructor/1.0/js/?um=constructor%3A9139e7b40f56f89ed06349a0badbf87d1797f1059fb798e77c186827f38299ec&amp;width=100%25&amp;height=400&amp;lang=ru_RU&amp;scroll=true,Метраж от 88 до 420,98,88,440,"Клубный поселок делюкс-класса на территории заповедника"" Серебряный бор""","<p>Клубный поселок делюкс-класса на территории заповедника Серебряный бор из 3-х зданий с апартаментами, 14-ти таунхаусов и вилл. </p><p>Компромисс между городской и загородной жизнью — рядом причал и лодочная станция, вокруг охраняемый парк Серебряный бор. </p><p>В апартаментах, таунхаусах и виллах есть возможность установить камин. </p><p>Из окон открывается вид на реку и Живописный мост. </p><p>У апартаментов на первых этажах и боковых таунхаусов приватные террасы с выходом в уютный внутренний двор, который разделен живой изгородью. </p><p>В комплексе развивают гребной спорт — будет организован свой клуб, спортивная школа, дети смогут выезжать на международные соревнования.</p><p>апартаменты, таунхаусы и виллы от 1 000 000 рублей за м2.</p><p>15 мин. до центра: Арбат, Тверская</p><p>20 мин. до Красной Площади </p><p>40-50 мин. до аэропортов Шерметьево и Внуково</p><p>С выходом в сад: площадь от 88 до 220 м2, 1-4 спальни</p><p>С выходом к реке: площадь от 220 до 240 м2, 4-5 спален</p><p>С участком на берегу: площадь от 315 до 440 м2, 4-6 спален </p>",,https://uploads-ssl.webflow.com/620e15709e3fbe1a70764578/623f723d7d19483e9aaddf30_SB_day_00017.jpg,https://uploads-ssl.webflow.com/620e15709e3fbe1a70764578/623f72436dc3f0e2d905ef56_SB_day_00039.jpg,https://uploads-ssl.webflow.com/620e15709e3fbe1a70764578/623f6f7db4ae64b1d2f268a1_%D0%A1%D0%BD%D0%B8%D0%BC%D0%BE%D0%BA%20%D1%8D%D0%BA%D1%80%D0%B0%D0%BD%D0%B0%202022-03-26%20%D0%B2%2022.54.32.png,https://uploads-ssl.webflow.com/620e15709e3fbe1a70764578/623f71d72c7bdd961b8861be_%D0%9F%D1%80%D0%B5%D0%B7%D0%B5%D0%BD%D1%82%D0%B0%D1%86%D0%B8%D1%8F%20%D0%B1%D1%83%D0%BA%D0%BB%D0%B5%D1%82_compressed-2.pdf,https://uploads-ssl.webflow.com/620e15709e3fbe1a70764578/623f725b6dc3f0005e05eff1_SB_day_00002.jpg; https://uploads-ssl.webflow.com/620e15709e3fbe1a70764578/623f725beca5265ce386b044_SB_day_00024.jpg; https://uploads-ssl.webflow.com/620e15709e3fbe1a70764578/623f725bcb3f407ee65354ad_SB_night_00000.jpg; https://uploads-ssl.webflow.com/620e15709e3fbe1a70764578/623f725bb4ae64d855f27f95_SB_night_00005.jpg; https://uploads-ssl.webflow.com/620e15709e3fbe1a70764578/623f725b9ae6d7f1236bc73f_SB_night_00040.jpg,
