Name,Slug,Collection ID,Item ID,Created On,Updated On,Published On,Перевод названия,Area,Contact,Clicks Amount,Price per meter,Price,Address,District,Metro,Yandex Adres Link,Available areas,Lots Number,Min square,Max square,Краткая фраза,Description,Тип недвижимости,Tittle Image,Second Image,Logo,Presentation,photos,Порядок на главной странице
8 Yards ,8-yards,623d9555a6e491964c6ab9bc,624fcea6f951fa0b893a7d07,Fri Apr 08 2022 05:56:54 GMT+0000 (Coordinated Universal Time),Wed Jul 13 2022 18:29:26 GMT+0000 (Coordinated Universal Time),Wed Jul 13 2022 18:35:26 GMT+0000 (Coordinated Universal Time),Восемь ярдов,hamovniki,soboleva-svetlana,0,по запросу ,по запросу ,"улица Ефремова, 9А",ЦАО,м. Фрунзенская,https://api-maps.yandex.ru/services/constructor/1.0/js/?um=constructor%3Aaab7a7a20dda4d71352e4bda3f45b8ec9a470e982dd62c2d6103b5a9a9a5fa32&amp;width=100%25&amp;height=400&amp;lang=ru_RU&amp;scroll=true,От 243 до 385,8,243,385,Современная концепция в класическом исполнении,"<p>Eight Yards — владения из 8 таунхаусов делюкс-класса в Хамовниках. </p><p>7 таунхаусов высотой 3 этажа, восьмой — двухэтажный. </p><p>Все дома выходят на две стороны, у каждого приватное патио и открытая терраса на верхнем этаже. </p><p>С террас открывается вид во внутренний сад с крупными деревьями и ландшафтным дизайном в английском стиле. </p><p>Фасады выполнены в английском стиле, серый клинкерный кирпич используется в отделке 3-хэтажных таунхаусов, а 2-хэтажный оформлен мрамором. </p><p>На любом этаже можно установить камин. </p><p>На цокольных этажах предусмотрены пространства для сауны, тренажёрного зала и комнат для персонала. </p><p>Для больший таунхаусов включены 3 места в подземном паркинге, для малого — 2 места</p>",Новостройки,https://uploads-ssl.webflow.com/620e15709e3fbe1a70764578/624f0224b4cf3483a8947ec2_1-min.jpg,https://uploads-ssl.webflow.com/620e15709e3fbe1a70764578/624f07ac15b6652b0f48e085_Ptichka_Efremowo-min.jpg,https://uploads-ssl.webflow.com/620e15709e3fbe1a70764578/628e0622f2223a33793dbf46_Eight%20Yards.svg,https://uploads-ssl.webflow.com/620e15709e3fbe1a70764578/624f02da279e2a37bac0de67_8_Yards_present_compressed.pdf,https://uploads-ssl.webflow.com/620e15709e3fbe1a70764578/624f0241bc6b37d49cd1251e_%D1%80%D0%B0%D0%BA%D1%83%D1%80%D1%8144-min.jpg; https://uploads-ssl.webflow.com/620e15709e3fbe1a70764578/624f02431599207bca0cda6b_WhatsApp%20Image%202021-08-24%20at%2013.48.43%20(2)-min.jpeg; https://uploads-ssl.webflow.com/620e15709e3fbe1a70764578/624f024dbc6b37e7bdd126cb_%D0%BA%D0%B0%D0%BC%D0%B5%D1%80%D0%B0%20012_1-min.jpg; https://uploads-ssl.webflow.com/620e15709e3fbe1a70764578/624f04ef70adc2649df56911_%D0%92%D0%B8%D0%B4_1%20(1)-min.jpg; https://uploads-ssl.webflow.com/620e15709e3fbe1a70764578/624f025321a7dbbe0ac50f86_%D0%BA%D0%B0%D0%BC%D0%B5%D1%80%D0%B0%20016-min.jpg,
Абрикосов,abrikosov,623d9555a6e491964c6ab9bc,623d9555a6e4913ff26aba03,Wed Mar 23 2022 15:21:16 GMT+0000 (Coordinated Universal Time),Wed May 25 2022 11:01:59 GMT+0000 (Coordinated Universal Time),Wed May 25 2022 11:25:42 GMT+0000 (Coordinated Universal Time),,basmannyy,soboleva-svetlana,,по запросу,по запросу,"Потаповский переулок, 6",ЦАО,м. Чистые пруды,https://api-maps.yandex.ru/services/constructor/1.0/js/?um=constructor%3A5f04651173123376be4abb5ca27f83417ede510396539ff56b7a6d6ad25e5f42&amp;width=100%25&amp;height=400&amp;lang=ru_RU&amp;scroll=true,от 65 до 350,23,65,350,Реконструкция исторического дома купцов Абрикосовых в 5 минутах от Чистопрудного бульвара. ,"<p>Квартиры с ценой по запросу «Абрикосов» — реконструкция исторического дома купцов Абрикосовых в 5 минутах от Чистопрудного бульвара. </p><p>В доме всего 23 квартиры с отделкой whitebox и дровяными каминами. </p><p>На верхнем этаже двухуровневая 820-метровая квартира Абрикосова с восстановленной исторической отделкой, приватным входом и выходом в парк. </p><p>Светлый фасад пятиэтажного здания оштукатурен и украшен лепниной. </p><p>3 входные группы с каминами выполнены в разных оттенках, украшены мрамором, росписью и восстановленной лепниной.</p><p>Организован автоматизированный подземный паркинг на 56 машин с помещениями для водителей. </p><p>В цокольном этаже оборудовали спортивный зал, резидентам доступны келлеры или винный погреб.</p><p>‍</p>",Новостройки,https://uploads-ssl.webflow.com/620e15709e3fbe1a70764578/623b4146a84b683551e07603_abrikosov-min.png,https://uploads-ssl.webflow.com/620e15709e3fbe1a70764578/623b41adc100125c039d16e0_abrikosov-2-min.png,https://uploads-ssl.webflow.com/620e15709e3fbe1a70764578/628e0ca3a6206363fcf4ae03_%D0%90%D0%B1%D1%80%D0%B8%D0%BA%D0%BE%D1%81%D0%BE%D0%B2.svg,https://uploads-ssl.webflow.com/620e15709e3fbe1a70764578/623b3e4cc0984bf41d52cddd_%D0%B1%D1%83%D0%BA%D0%BB%D0%B5%D1%82%20%D0%90%D0%B1%D1%80%D0%B8%D0%BA%D0%BE%D1%81%D0%BE%D0%B2.pdf,https://uploads-ssl.webflow.com/620e15709e3fbe1a70764578/623f5aacc49a369eca5adc96_photo2-min.png; https://uploads-ssl.webflow.com/620e15709e3fbe1a70764578/623f5aac24856155dd99a8c7_photo5-min.png; https://uploads-ssl.webflow.com/620e15709e3fbe1a70764578/623f5aacb3c79868a4d15f35_photo6-min.png; https://uploads-ssl.webflow.com/620e15709e3fbe1a70764578/623f5aac9ae6d746606b01d7_photo7-min.png; https://uploads-ssl.webflow.com/620e15709e3fbe1a70764578/623f5aacc08a811c928678f4_photo8-min.png,
Ahead,ahead,623d9555a6e491964c6ab9bc,629121d103f9807b2b089617,Fri May 27 2022 19:09:05 GMT+0000 (Coordinated Universal Time),Wed Sep 07 2022 20:26:12 GMT+0000 (Coordinated Universal Time),Wed Sep 07 2022 20:41:05 GMT+0000 (Coordinated Universal Time),,filevskiy-park,soboleva-svetlana,,675 000 ,25 000 000,ул. Василисы Кожиной ,ЗСА,м. Филевский парк,https://api-maps.yandex.ru/services/constructor/1.0/js/?um=constructor%3A71308bd68bc3048baaf5900bf41c1e018550d51b22f043699665cdca5610e5e3&amp;width=100%25&amp;height=400&amp;lang=ru_RU&amp;scroll=true,от 37 до 185 ,11,37,185,Апартаменты премиум – класса в центре Кутузовского,"<p id=""""><strong id="""">Описание.</strong>&nbsp;Ahead – 17-этажный комплекс общей площадью 26,4 тыс. кв.метров, включающий офисную часть (первые шесть этажей) и жилую с апартаментамипремиум-класса. Их разделяет общественная терраса. На коммерческие иинфраструктурные объекты отведено 11,7 тыс. кв. метров площадей, на апартаменты– 7,8 тыс. кв. метров. В офисной части будут фасады с регулярной сеткой изметаллических ламелей, в жилой – пластина будет собрана из квадратных ячеек,панорамных окон, повернутых под различным углом.</p><p id=""""><strong id="""">Внутренняя инфраструктура.</strong>На седьмом этаже расположится общественнаятерраса sky lobby. Будет Air Fitness с окнами-трансформерами. На первом этажеоборудуют mute room – комнату с звукоизоляцией для занятия вокалом и медитации.На двух подземных этажах сделают паркинг с 153 машино-местами и 30 кладовымипомещениями.</p><p id=""""><strong id="""">Инженерия.</strong>&nbsp;Ahead – первый в России проект с жилой составляющей,сертифицированным по стандарту Fitwel. В здании установят датчики контролявоздуха по пяти параметрам. </p><p id=""""><strong id="""">Место.</strong>&nbsp;Ahead находится в районе Кутузовского проспекта в километре от станции метро «Филевский парк». </p>",Новостройки,https://uploads-ssl.webflow.com/620e15709e3fbe1a70764578/62911f84da6f716d9aad79fe_%D0%A1%D0%BD%D0%B8%D0%BC%D0%BE%D0%BA%20%D1%8D%D0%BA%D1%80%D0%B0%D0%BD%D0%B0%202022-05-27%20%D0%B2%2021.50.22-min.png,https://uploads-ssl.webflow.com/620e15709e3fbe1a70764578/62911f8c1d18aa6016752600_%D0%A1%D0%BD%D0%B8%D0%BC%D0%BE%D0%BA%20%D1%8D%D0%BA%D1%80%D0%B0%D0%BD%D0%B0%202022-05-27%20%D0%B2%2021.49.35-min.png,https://uploads-ssl.webflow.com/620e15709e3fbe1a70764578/629743984f2cac251a007249_AHEAD.svg,https://uploads-ssl.webflow.com/620e15709e3fbe1a70764578/62911d2ca342d5b1eae58dbb_Ahead_Presentation%20%E2%80%94%20%D0%BA%D0%BE%D0%BF%D0%B8%D1%8F_removed_compressed.pdf,https://uploads-ssl.webflow.com/620e15709e3fbe1a70764578/62911f8b4d28167d17f5dd63_%D0%A1%D0%BD%D0%B8%D0%BC%D0%BE%D0%BA%20%D1%8D%D0%BA%D1%80%D0%B0%D0%BD%D0%B0%202022-05-27%20%D0%B2%2021.50.13-min.png; https://uploads-ssl.webflow.com/620e15709e3fbe1a70764578/62911f8bfed3519754eb473a_%D0%A1%D0%BD%D0%B8%D0%BC%D0%BE%D0%BA%20%D1%8D%D0%BA%D1%80%D0%B0%D0%BD%D0%B0%202022-05-27%20%D0%B2%2021.50.01-min.png; https://uploads-ssl.webflow.com/620e15709e3fbe1a70764578/62911f7eebfe79596617db62_%D0%A1%D0%BD%D0%B8%D0%BC%D0%BE%D0%BA%20%D1%8D%D0%BA%D1%80%D0%B0%D0%BD%D0%B0%202022-05-27%20%D0%B2%2021.49.46-min.png; https://uploads-ssl.webflow.com/620e15709e3fbe1a70764578/62911f8b828bfbf28294c73a_%D0%A1%D0%BD%D0%B8%D0%BC%D0%BE%D0%BA%20%D1%8D%D0%BA%D1%80%D0%B0%D0%BD%D0%B0%202022-05-27%20%D0%B2%2021.50.49-min.png; https://uploads-ssl.webflow.com/620e15709e3fbe1a70764578/62911f8b22000d1cbed0ddde_%D0%A1%D0%BD%D0%B8%D0%BC%D0%BE%D0%BA%20%D1%8D%D0%BA%D1%80%D0%B0%D0%BD%D0%B0%202022-05-27%20%D0%B2%2021.50.33-min.png,
Allegoria Mosca,allegoria-mosca,623d9555a6e491964c6ab9bc,625deb32316d7caedb4670ea,Mon Apr 18 2022 22:50:26 GMT+0000 (Coordinated Universal Time),Wed Sep 07 2022 20:00:04 GMT+0000 (Coordinated Universal Time),Wed Sep 07 2022 20:00:30 GMT+0000 (Coordinated Universal Time),Аллегория Моска,hamovniki,soboleva-svetlana,,1 200 000,по запросу,"Остоженка, д. 6 стр. 1",ЦАО,м. Кропоткинская,https://api-maps.yandex.ru/services/constructor/1.0/js/?um=constructor%3A65387fb3f1fac42b05e8f1d716387053b4c9bbe7d66bb3e3b2bf0d75de77e98d&amp;width=100%25&amp;height=400&amp;lang=ru_RU&amp;scroll=true,от 60 до 713,37,60,713,"ALLEGORIA MOSCA — ГОРОДСКОЙ ДВОРЕЦ, ЖИЛОЙ ПАЛАЦЦО В САМОМ ЦЕНТРЕ ИСТОРИЧЕСКОГО ГОРОДА.","<p>Allegoria Mosca — современный жилой комплекс в историческом сердце Москвы. Стрелка двух старейших улиц города — Пречистенки и Остоженки. Каждый квадратный метр земли здесь дышит историей. Архитектура комплекса продиктована сочетанием образной интерпретации древних московских палат и итальянских палаццо.</p><p>Жилой особняк с роскошным видом и богатой инфраструктурой вырастет на земле которая буквально состоит из истории города концентрированной в каждом камне, каждом фасаде старейших улиц Москвы, что делает это место по-настоящему уникальным для жизни.</p>",Новостройки,https://uploads-ssl.webflow.com/620e15709e3fbe1a70764578/625deab5434bec10859b0e10_ext_10.jpg,https://uploads-ssl.webflow.com/620e15709e3fbe1a70764578/625deab9e07aafb6300a74a0_ext_4.jpg,https://uploads-ssl.webflow.com/620e15709e3fbe1a70764578/628e0359532a521bc7f84bf1_ALLEGORIA%20MOSCA.svg,,https://uploads-ssl.webflow.com/620e15709e3fbe1a70764578/625deaf6e07aafe1b40a74a7_ext_3.jpg; https://uploads-ssl.webflow.com/620e15709e3fbe1a70764578/625deab9e07aafb6300a74a0_ext_4.jpg; https://uploads-ssl.webflow.com/620e15709e3fbe1a70764578/625deaf5271288e5e4f01b30_ext_6.jpg; https://uploads-ssl.webflow.com/620e15709e3fbe1a70764578/625deab5434bec10859b0e10_ext_10.jpg; https://uploads-ssl.webflow.com/620e15709e3fbe1a70764578/625deaf24c2d9d5df9aeef74_int_9.jpg,
Ambassador Residence,ambassador-golf-club-residence,623d9555a6e491964c6ab9bc,625dceee559801988204eb56,Mon Apr 18 2022 20:49:50 GMT+0000 (Coordinated Universal Time),Wed May 25 2022 10:22:52 GMT+0000 (Coordinated Universal Time),Wed May 25 2022 11:25:42 GMT+0000 (Coordinated Universal Time),Амбассадор гольф клуб,ramenki,soboleva-svetlana,,1 012 000,по запросу,ул. Довженко д. 4,ЗАО,м. Минская,https://api-maps.yandex.ru/services/constructor/1.0/js/?um=constructor%3Adf5b9a1a19d19117f7d16287e33e8126f847124a5ef1e918f504a4544ad78c01&amp;width=100%25&amp;height=400&amp;lang=ru_RU&amp;scroll=true,от 83 до 177,63,83,177,Клубный дом elite - класса у полей легендарного гольф-клуба.,<p>Комплекс «Амбассадор» — это жизнь в апартаментах элит-класса на западе центра Москвы. Клубный дом возведен среди зелени в традициях современной европейской архитектуры у полей Московского городского Гольф Клуба. Членство в клубе подчеркивает эксклюзивность жизни резидента Ambassador Golf Club Residence и предоставляет ряд привилегий. </p><p>‍</p>,Новостройки,https://uploads-ssl.webflow.com/620e15709e3fbe1a70764578/625dced2f3849b37d940c304_1.jpg,https://uploads-ssl.webflow.com/620e15709e3fbe1a70764578/625dced620570ec5ac1af9e5_2.jpg,https://uploads-ssl.webflow.com/620e15709e3fbe1a70764578/628e037811845d7d69a2821e_AMBASSADOR.svg,,https://uploads-ssl.webflow.com/620e15709e3fbe1a70764578/625dced2f3849b37d940c304_1.jpg; https://uploads-ssl.webflow.com/620e15709e3fbe1a70764578/625dced620570ec5ac1af9e5_2.jpg; https://uploads-ssl.webflow.com/620e15709e3fbe1a70764578/625dcedff3849b360f40c710_3.jpg; https://uploads-ssl.webflow.com/620e15709e3fbe1a70764578/625dcede559801373604e6c1_4.jpg; https://uploads-ssl.webflow.com/620e15709e3fbe1a70764578/625dcede15edd18770520153_5.jpg,
Art House,arthaus,623d9555a6e491964c6ab9bc,62911bcada1b1dfbeb4ca09d,Fri May 27 2022 18:43:22 GMT+0000 (Coordinated Universal Time),Wed Oct 05 2022 09:25:58 GMT+0000 (Coordinated Universal Time),Wed Oct 05 2022 09:26:03 GMT+0000 (Coordinated Universal Time),Арт Хаус,taganskiy,soboleva-svetlana,,1 416 807 ,195 000 000 ,"Серебряническая набережная, 19",ЦАО,м. Чкаловская,,от 80 до 250,30,80,250,Элитный жилой кластер на берегу реки Яузы !,"<p>ЖК&nbsp;«АртХаус»Москва&nbsp;— это два корпуса высотой до&nbsp;6&nbsp;этажей, в&nbsp;которыхв&nbsp;сумме расположено 30&nbsp;комфортабельных квартир с&nbsp;высокимипотолками и&nbsp;огромными окнами. Идея проекта принадлежит архитектурному бюроСергея Скуратова, а&nbsp;застройщиком выступила компания State Development.Жилой комплекс расположился в&nbsp;центре города, на&nbsp;берегу Яузы,в&nbsp;престижном и&nbsp;красивом месте. Площадь квартир в&nbsp;этом клубномдоме составляет до&nbsp;250 кв.м.</p><p>Комплекс был возведенпо&nbsp;оригинальному архитектурному проекту в&nbsp;стиле так называемогопромышленного дизайна: облицовка клинкерным кирпичом, наклонные линии, большиеокна. В&nbsp;корпусе «А» расположено 12&nbsp;квартир, а&nbsp;комплекс «Б»насчитывает 18&nbsp;апартаментов. Площадь квартир в&nbsp;ЖК&nbsp;«АртХаус»составляет от&nbsp;80&nbsp;до&nbsp;250 кв.м., а&nbsp;высота потолков разнитсяот&nbsp;3,8 до&nbsp;5, 1&nbsp;метра. Площадь пентхаусов составляет 450 кв.м.На&nbsp;внутренней территории созданы зоны отдыха, установлены лавочкии&nbsp;высажены газоны и&nbsp;деревья.</p>",Новостройки,https://uploads-ssl.webflow.com/620e15709e3fbe1a70764578/629119ab65197a32d11070ad_ececddaf829e4ad314e00d2352b50f32e52a85b4_18_1100.png,https://uploads-ssl.webflow.com/620e15709e3fbe1a70764578/629119b035aacf308c3dc805_4168b90ae499258843d32ca1d197b22e9a1608e1_18_1100%2021.25.23.png,https://uploads-ssl.webflow.com/620e15709e3fbe1a70764578/62911a0a4d281625f0f57ce4_logo_A_light.svg,,https://uploads-ssl.webflow.com/620e15709e3fbe1a70764578/629117ba4aad950c8533faf2_f1863e8c16d435fcfc0601d62dc7bd2768245b65_18_1100.png; https://uploads-ssl.webflow.com/620e15709e3fbe1a70764578/629119994dab8a24b2c02c19_0f3bf29e195576ac22e412c1ba4c451d242319de_18_1100.png; https://uploads-ssl.webflow.com/620e15709e3fbe1a70764578/629119993e79ed5ee6f1031f_06f10c3c8f20016429577f2bb1be12d930d3f79f_18_1100.png; https://uploads-ssl.webflow.com/620e15709e3fbe1a70764578/629119c33e00f848f52cf893_55a227eec393423a3cd7a231b543c86b8fb77903_18_1100.png; https://uploads-ssl.webflow.com/620e15709e3fbe1a70764578/629119c3828bfbc6e8946234_86c7b24bac09749fdde74e3be846d27b62aaef99_18_1100.png,
Artisan ,artisan,623d9555a6e491964c6ab9bc,624fd8151225745b30b628a7,Fri Apr 08 2022 06:37:09 GMT+0000 (Coordinated Universal Time),Wed Jul 13 2022 18:29:44 GMT+0000 (Coordinated Universal Time),Wed Jul 13 2022 18:35:26 GMT+0000 (Coordinated Universal Time),Артисан,arbat,soboleva-svetlana,0,1 151 894 ,83 973 103 ,"улица Арбат, 39",ЦАО,м. Смоленская,https://api-maps.yandex.ru/services/constructor/1.0/js/?um=constructor%3A9c7fc6f213f1a786beca4839da934f86e831de5445b62e79ad2c4b7ceb5e3f6d&amp;width=100%25&amp;height=400&amp;lang=ru_RU&amp;scroll=true,От 56 до 316,30,56,316,Клубный дом особого качества,"<p>Клубный дом на 30 резиденций делюкс-класса на Арбате. </p><p>Есть лоты с террасой и вторым светом, у пентхаусов выход на кровлю. </p><p>Из окон открываются виды на Арбат, Кривоколенный переулок, дом Мельникова и Храм Спаса Преображения. </p><p>Со стороны Арбата торжественный фасад выполнен в эклектичном стиле архитектуры XIX века – колонны коринфского ордера, портик, скульптурные группы и изящная лепнина. </p><p>Внутренний фасад в современном стиле с панорамным остеклением и клинкером. </p><p>Жителей встречает круглосуточный консьерж-сервис, три лобби в своём стиле с отделкой натуральных пород мрамора, дерева и рукотворным декором. </p><p>Во внутреннем дворе фасад выполнили из коричневого кирпича ручной формовки. </p><p>На приватной территории создали мини-сад с необычным ландшафтом и освещением. Подземный паркинг на 77 машин.</p><p>‍</p>",Новостройки,https://uploads-ssl.webflow.com/620e15709e3fbe1a70764578/624fd2940f05b8c610c5559f_AX8A2086-HDR-min.jpg,https://uploads-ssl.webflow.com/620e15709e3fbe1a70764578/624fd22f314de618ad6cdb55_Artisan_View00003_Post-min.png,https://uploads-ssl.webflow.com/620e15709e3fbe1a70764578/628e039160cc1b8750528230_Artizan.svg,https://uploads-ssl.webflow.com/620e15709e3fbe1a70764578/624fd27870ba2fbcea4e515e_Artisan%20ID_%D0%BF%D1%80%D0%B5%D0%B7%D0%B5%D0%BD%D1%82%D0%B0%D1%86%D0%B8%D1%8F_%D0%91%D0%9A_compressed.pdf,https://uploads-ssl.webflow.com/620e15709e3fbe1a70764578/624fd22e13c4ef6a157f1343_AX8A2065-HDR-min.jpg; https://uploads-ssl.webflow.com/620e15709e3fbe1a70764578/624fd237fb8c8b088a3d6cd4_AX8A2080-HDR-min.jpg; https://uploads-ssl.webflow.com/620e15709e3fbe1a70764578/624fd7e2a361ddce89075a9b_Artisan_View00001_Post-min.png; https://uploads-ssl.webflow.com/620e15709e3fbe1a70764578/624fd2377944866aa327a06f_AX8A2510-HDR-min.jpg; https://uploads-ssl.webflow.com/620e15709e3fbe1a70764578/624fd2371e8e7ae050b00ac8_AX8A2234-HDR-min.jpg,
Astris,astris,623d9555a6e491964c6ab9bc,623f6979908dde58f1c9a393,Sat Mar 26 2022 19:28:57 GMT+0000 (Coordinated Universal Time),Wed Jul 13 2022 18:28:33 GMT+0000 (Coordinated Universal Time),Wed Jul 13 2022 18:35:26 GMT+0000 (Coordinated Universal Time),Астрис,ramenki,soboleva-svetlana,,1 929 000 ,262 344 000,"ул. Косыгина, 21",ЗАО,м. Воробьевы горы,https://api-maps.yandex.ru/services/constructor/1.0/js/?um=constructor%3A3f557fcdae984ac99685274f7c6e61ebc35ef10ab4e2167ea99aa8c65b9cab38&amp;width=100%25&amp;height=400&amp;lang=ru_RU&amp;scroll=true,от 127 до 475,38,127,475,"Классический стиль, высочайшее качество материалов, изысканные интерьеры.","<p>Клубный дом находится в престижном Гагаринском районе, в 5 минутах ходьбы от МГУ и Воробьёвых гор. </p><p>Лоты с отделкой под ключ и отделкой whitebox, во всех камины с открытой топкой.</p><p>Отделка выполнена в современном классическом стиле. </p><p>Полы из натурального дерева и итальянского мрамора. </p><p>Установлены итальянские кухни Rossana с техникой Miele, оборудованные ванные комнаты. </p><p>Для комфорта жильцов установлены системы фильтрации воды, воздуха и централизованного увлажнения.</p><p>Управление системой умный дом через приложение или домашний пульт.</p><p>На этаже по две квартиры. </p><p>Есть двухуровневые таунхаусы с патио и пентхаусы с выходом на кровлю.</p><p>‍</p>",,https://uploads-ssl.webflow.com/620e15709e3fbe1a70764578/623f693004eebcb585658dc7_%D0%B1%D0%BE%D0%BA%D0%BE%D0%B2%D0%BE%D0%B9%20%D1%80%D0%B0%D0%BA%D1%83%D1%80%D1%81%203_00000.jpg,https://uploads-ssl.webflow.com/620e15709e3fbe1a70764578/623f6935d47c0572b970be04_%D1%81%D1%80%D0%B5%D0%B4%D0%BD%D0%B8%D0%B9%20%D0%BF%D0%BB%D0%B0%D0%BD%201_00000.jpg,https://uploads-ssl.webflow.com/620e15709e3fbe1a70764578/628e03ae4d650e3ef0e2dc4d_astris.svg,https://uploads-ssl.webflow.com/620e15709e3fbe1a70764578/623f671a9ae6d754846b7c2a_%D0%9F%D1%80%D0%B5%D0%B7%D0%B5%D0%BD%D1%82%D0%B0%D1%86%D0%B8%D1%8F%20%D0%B1%D1%83%D0%BA%D0%BB%D0%B5%D1%82_compressed.pdf,https://uploads-ssl.webflow.com/620e15709e3fbe1a70764578/623f69447060124239bc8d61_DJI_0053.jpg; https://uploads-ssl.webflow.com/620e15709e3fbe1a70764578/623f694551b8b26094aa94b1_%D1%84%D1%80%D0%BE%D0%BD%D1%82%D0%B0%D0%BB%D1%8C%D0%BD%D1%8B%D0%B9%20%D0%B2%D0%B8%D0%B4%20%D0%BD%D0%B0%20%D0%B4%D0%BE%D0%BC%201_00000.jpg; https://uploads-ssl.webflow.com/620e15709e3fbe1a70764578/623f69452485617ed59a05a3_IMG_6647.jpg; https://uploads-ssl.webflow.com/620e15709e3fbe1a70764578/623f6945b3c7982100d1b9f5_IMG_6426.jpg; https://uploads-ssl.webflow.com/620e15709e3fbe1a70764578/623f69448e487612d86d0603_IMG_6553.jpg,
