CULT ,cult,623d9555a6e491964c6ab9bc,624fde641db074541b7fd704,Fri Apr 08 2022 07:04:04 GMT+0000 (Coordinated Universal Time),Wed Jul 13 2022 18:30:03 GMT+0000 (Coordinated Universal Time),Wed Jul 13 2022 18:35:26 GMT+0000 (Coordinated Universal Time),Культ,yakimanka,soboleva-svetlana,0,1 221 335 ,33 049 335,"Ленинский пр., д. 2",ЦАО,м. Октябрьская ,https://api-maps.yandex.ru/services/constructor/1.0/js/?um=constructor%3A1f4ff96323999ba2333de2fd0ffeca9ed1c1ac7fcff922e5f6951acf699c2b64&amp;width=100%25&amp;height=400&amp;lang=ru_RU&amp;scroll=true,От 27 до 106,91,27,106,CULT — клубный дом на 91 апартамент в районе Якиманки у станции метро «Октябрьская».,"<p>CULT — клубный дом на 91 апартамент в районе Якиманки у станции метро «Октябрьская». Архитектура от бюро SPEECH, под руководством Сергея Чобана. </p><p>Фасады из мраморизованного известняка нежно-кремового оттенка выполнили в современном стиле с бронзовыми акцентами. Лобби оформили в темно-шоколадной гамме с мягкой мебелью молочных оттенков. </p><p>Для жителей комплекса работает консьерж и открыт фитнес-центр с зоной SPA. </p><p>Апартаменты со 2 по 7 этаж с отделкой «под ключ» и встроенной кухней. </p><p>Апартаменты на 8 и 9 этажах без отделки с высотой потолков 4,4 метра с возможностью установки дровяного камина.</p><p>У пентхаусов дополнительно организовали приватные террасы на крыше дома.</p>",Новостройки,https://uploads-ssl.webflow.com/620e15709e3fbe1a70764578/624fde361fb642f2adeb4145_%D0%A1%D0%BD%D0%B8%D0%BC%D0%BE%D0%BA%20%D1%8D%D0%BA%D1%80%D0%B0%D0%BD%D0%B0%202022-04-08%20%D0%B2%2010.02.45-min.png,https://uploads-ssl.webflow.com/620e15709e3fbe1a70764578/624fde43314de6a4876d5040_%D0%BF%D1%80%D0%B8%20%D0%B2%D1%85%D0%BE%D0%B4%D0%B5%20%D0%BD%D0%B0%20%D1%82%D0%B5%D1%80%D1%80%D0%B8%D1%82%D0%BE%D1%80%D0%B8%D1%8E-min.jpg,https://uploads-ssl.webflow.com/620e15709e3fbe1a70764578/628e03eb1adbbe3cfbe4b697_CULT.svg,https://uploads-ssl.webflow.com/620e15709e3fbe1a70764578/624fdd143a3a8cc61be95a57_GRAVION%20by%20CULT_compressed.pdf,https://uploads-ssl.webflow.com/620e15709e3fbe1a70764578/624fde5dc641a555c5112d2c__USA1129-min.jpg; https://uploads-ssl.webflow.com/620e15709e3fbe1a70764578/624fde5da2cd9928b715599e__USA1137-min.jpg; https://uploads-ssl.webflow.com/620e15709e3fbe1a70764578/624fde5d768876103f36116d__USA0985-min.jpg; https://uploads-ssl.webflow.com/620e15709e3fbe1a70764578/624fde5cf943c2fdd83529eb_%D0%B2%D0%B5%D1%87%D0%B5%D1%80-min.jpg; https://uploads-ssl.webflow.com/620e15709e3fbe1a70764578/624fde5c6a4986149f61249e_%D0%B2%D1%85%D0%BE%D0%B4%20%D0%B2%20%D0%BB%D0%BE%D0%B1%D0%B1%D0%B8-min.jpg,
Большая Дмитровка IX,dmitrovka-9,623d9555a6e491964c6ab9bc,623d9555a6e4918c9a6aba04,Wed Mar 23 2022 16:11:03 GMT+0000 (Coordinated Universal Time),Wed Jul 13 2022 18:27:48 GMT+0000 (Coordinated Universal Time),Wed Jul 13 2022 18:35:26 GMT+0000 (Coordinated Universal Time),,tverskoy,soboleva-svetlana,0,по запросу,по запросу,"Большая Дмитровка, д. 9",ЦАО,м. Охотный ряд ,https://api-maps.yandex.ru/services/constructor/1.0/js/?um=constructor%3A24bca3bba3483f4e0b7c6be83965d75e6891b265fb3a316cfdf7c51eb1e18938&amp;width=100%25&amp;height=400&amp;lang=ru_RU&amp;scroll=true,от 81 до 344,96,81,344,Старинный особняк после комплексной реконструкции с точным воспроизведением фасада 1912 года,"<p>«Большая Дмитровка IX» – проект реставрации объекта культурного наследия и новое строительство двух особняков. На закрытой территории расположены камерные особняки с апартаментами, вертикальный лес и 3-уровневый подземный паркинг.</p><p>Особняки «Порода» и «Свет» – это новое строительство с использованием современных технологий. Фасады особняков выполнены из архитектурного бетона, стекла и вулканического туфа. Лобби особняков – это роскошные парадные галереи, украшенные лепниной, мрамором и декоративными элементами из металла.</p><p>Для жителей предусмотрена вся необходимая инфраструктура, включая приватный фитнес-клуб и SPA-зону. У особняков есть приватные скверы, созданные под настроение фасадов. Сквер особняка «Порода» украшает уникальный вертикальный лес.</p><p>Завершение строительства – 2 квартал 2022 года.</p><p>‍</p>",Новостройки,https://uploads-ssl.webflow.com/620e15709e3fbe1a70764578/623b4644c85e866809575b1e_photo1-min.png,https://uploads-ssl.webflow.com/620e15709e3fbe1a70764578/623b4651c1001202039d412f_photo2-min.png,https://uploads-ssl.webflow.com/620e15709e3fbe1a70764578/628e0f4cf2223a169a3e0b44_%D0%91%D0%BE%D0%BB%D1%8C%D1%88%D0%B0%D1%8F%20%D0%94%D0%BC%D0%B8%D1%82%D1%80%D0%BE%D0%B2%D0%BA%D0%B0.svg,https://uploads-ssl.webflow.com/620e15709e3fbe1a70764578/623b43600893f025a782039c_%D0%98%D0%BC%D0%B8%D0%B4%D0%B6%D0%B5%D0%B2%D1%8B%D0%B9%20%D0%B1%D1%83%D0%BA%D0%BB%D0%B5%D1%82_%D0%91%D0%BE%D0%BB%D1%8C%D1%88%D0%B0%D1%8F%20%D0%94%D0%BC%D0%B8%D1%82%D1%80%D0%BE%D0%B2%D0%BA%D0%B0%20IX.pdf,https://uploads-ssl.webflow.com/620e15709e3fbe1a70764578/623f5bc67060126ef8bc1ccb_file6.png; https://uploads-ssl.webflow.com/620e15709e3fbe1a70764578/623f5bc63fa5f2f30d5009e6_photo2-min.png; https://uploads-ssl.webflow.com/620e15709e3fbe1a70764578/623f5bc63447db58a0392d6a_photo3-min.png; https://uploads-ssl.webflow.com/620e15709e3fbe1a70764578/623f5bc63a9f2e23b0be0be3_photo4-min.png; https://uploads-ssl.webflow.com/620e15709e3fbe1a70764578/623f5bc601ca8c0510fe2b57_photo5-min.png,
"Долгоруковская, 25",dolgorukovskaya-25,623d9555a6e491964c6ab9bc,62503c97e243193cee053340,Fri Apr 08 2022 13:45:59 GMT+0000 (Coordinated Universal Time),Wed Jul 13 2022 18:32:18 GMT+0000 (Coordinated Universal Time),Wed Jul 13 2022 18:35:26 GMT+0000 (Coordinated Universal Time),,tverskoy,soboleva-svetlana,0,803 489 ,31 095 012 ,"Долгоруковская улица, 25",ЦАО,м. Новослободская ,https://api-maps.yandex.ru/services/constructor/1.0/js/?um=constructor%3A27763347d7c99189946898888d4c92466a7fa18f315b8826ffe85b54983d55c0&amp;width=100%25&amp;height=400&amp;lang=ru_RU&amp;scroll=true,От 40 до 284,46,40,417,"Элегантная концепция, разработанная архитектурным бюро Apex Project.","<p>Два клубных дома премиум - класса в Тверском районе и двух минутах до Садового кольца. </p><p>В комплексе 46 апартаментов с отделкой white-box, двухуровневые пентхаусы с террасой и дровяным камином. </p><p>Клубный дом сертифицирован по британскому эко-стандарту BREEAM. </p><p>Фасад отделан кирпичом ручной формовки и панелями с античными формами. </p><p>Панорамные окна и французские балконы с напылением из меди. </p><p>Дизайн лобби в музыкальном и художественном стиле. </p><p>Внутри комплекса находится приватный дворик с детской игровой площадкой и зонами отдыха. На первом этаже откроют ресторан. </p><p>Для жителей предоставлен круглосуточный консьерж-сервис и подземный паркинг на 56 автомобилей.</p>",Новостройки,https://uploads-ssl.webflow.com/620e15709e3fbe1a70764578/62503c17292435529e531ad3_%D0%A1%D0%BD%D0%B8%D0%BC%D0%BE%D0%BA%20%D1%8D%D0%BA%D1%80%D0%B0%D0%BD%D0%B0%202022-04-08%20%D0%B2%2016.41.34-min.png,https://uploads-ssl.webflow.com/620e15709e3fbe1a70764578/62503c2a5542b05c1dcb8516_%D0%A1%D0%BD%D0%B8%D0%BC%D0%BE%D0%BA%20%D1%8D%D0%BA%D1%80%D0%B0%D0%BD%D0%B0%202022-04-08%20%D0%B2%2016.41.12-min.png,https://uploads-ssl.webflow.com/620e15709e3fbe1a70764578/628fe33816018b1816a78bfc_%D0%94%D0%BE%D0%BB%D0%B3%D0%BE%D1%80%D1%83%D0%BA%D0%BE%D0%B2%D1%81%D0%BA%D0%B0%D1%8F%2025.svg,https://uploads-ssl.webflow.com/620e15709e3fbe1a70764578/62503c61c0dbf124004d23ee_prez.pdf,https://uploads-ssl.webflow.com/620e15709e3fbe1a70764578/62503c7b3001de84286e2179_170724_RRD_%D0%91%D0%AD%D0%9B_%D0%94%D0%BE%D0%BB%D0%B3%D0%BE%D1%80%D1%83%D0%BA25_%D0%B2%D0%B5%D1%81%D1%82%D0%B8%D0%B1%D1%8E%D0%BB%D1%8C%D0%9C%D1%83%D0%B7_7-min.jpg; https://uploads-ssl.webflow.com/620e15709e3fbe1a70764578/62503c7b028fb741f99e3da1_%D0%9005_50%2C0_%D0%94%D0%BE%D0%BB%D0%B3%D0%BE%D1%80%D1%83%D0%BA_%D0%A1%D0%A31-min.jpg; https://uploads-ssl.webflow.com/620e15709e3fbe1a70764578/62503c7b2da9f4c6a5770854_170817_RRD_%D0%91%D0%AD%D0%9B_%D0%9425_%D0%B2%D0%B5%D1%81%D1%82%D0%B8%D0%B1%D1%8E%D0%BB%D1%8C%D0%A5%D1%83%D0%B4_%D0%9B%D0%B5%D1%81%D1%82%D0%BD%D0%B8%D1%86%D0%B0-min.jpg; https://uploads-ssl.webflow.com/620e15709e3fbe1a70764578/62503c7ab099330376a3834f_%D0%9005_50%2C0_%D0%94%D0%BE%D0%BB%D0%B3%D0%BE%D1%80%D1%83%D0%BA_%D0%A1%D0%BF%D0%B0%D0%BB_1-min.jpg,
Дом на Хлебном,dom-na-hlebnom,623d9555a6e491964c6ab9bc,625040ec39bd2940695863ae,Fri Apr 08 2022 14:04:28 GMT+0000 (Coordinated Universal Time),Wed Sep 07 2022 19:24:14 GMT+0000 (Coordinated Universal Time),Wed Sep 07 2022 19:24:21 GMT+0000 (Coordinated Universal Time),,arbat,soboleva-svetlana,0,2 678 928 ,от 253 694 481 ,"Хлебный пер., д. 19",ЦАО,м. Арбатская ,https://api-maps.yandex.ru/services/constructor/1.0/js/?um=constructor%3A4d8a51015719f025debc6c8d72f0247c805b1ac56b1514ebe35967426b6b0555&amp;width=100%25&amp;height=400&amp;lang=ru_RU&amp;scroll=true,От 105 до 363,13,105,363,"Памятник архитектуры 1913 года постройки на Арбате, отреставрированный под жилье класса де-люкс. ","<p>«Дом на Хлебном» — памятник архитектуры 1913 года постройки на Арбате, отреставрированный под жилье класса де-люкс. </p><p>В 8-этажном особняке расположилось всего 16 квартир и пентхаусы с открытыми террасами. </p><p>Архитектура, входные группы и интерьеры оформлены в стиле неоклассицизм. </p><p>Фасад со строгими формами и симметричными линиями из светлого натурального камня дополнили лепниной и скульптурами персонажей античной мифологии. </p><p>Дизайнеры из «Бюро 2+2» разработали 4 варианта отделки в сочетаниях классического и современного стилей с использованием мрамора, гранита и редких пород дерева. </p><p>Квартиры сдаются с кухней, бытовой техникой и оборудованной ванной комнатой. </p><p>Жителям доступен круглосуточный консьерж-сервис и парковка для 20 автомобилей с услугой valet-parking.</p>",Новостройки,https://uploads-ssl.webflow.com/620e15709e3fbe1a70764578/625da53df03fbbde36369f9b_%D0%BE%D1%81%D0%BD%D0%BE%D0%B2%D0%BD%D0%BE%D0%B9%20%D0%B2%D0%B5%D1%87%D0%B5%D1%80%D0%BD%D0%B8%D0%B9_00000.jpg,https://uploads-ssl.webflow.com/620e15709e3fbe1a70764578/625da548564f7d2a4548f7bb_%D0%BE%D1%81%D0%BD%D0%BE%D0%B2%D0%BD%D0%BE%D0%B9%20%D1%84%D1%80%D0%BE%D0%BD%D1%82%D0%B0%D0%BB%D1%8C%D0%BD%D1%8B%D0%B9_00000.jpg,https://uploads-ssl.webflow.com/620e15709e3fbe1a70764578/6297437c9acd781ac5663bc7_%D0%94%D0%9E%D0%9C%20%D0%9D%D0%90%20%D0%A5%D0%9B%D0%95%D0%91%D0%9D%D0%9E%D0%9C.svg,,https://uploads-ssl.webflow.com/620e15709e3fbe1a70764578/625da53df03fbbde36369f9b_%D0%BE%D1%81%D0%BD%D0%BE%D0%B2%D0%BD%D0%BE%D0%B9%20%D0%B2%D0%B5%D1%87%D0%B5%D1%80%D0%BD%D0%B8%D0%B9_00000.jpg; https://uploads-ssl.webflow.com/620e15709e3fbe1a70764578/625da56a1e463f6a59e1b8ad_%D0%B1%D0%BE%D0%BA%D0%BE%D0%B2%D0%BE%D0%B9%20%D1%80%D0%B0%D0%BA%D1%83%D1%80%D1%81%202_00000.jpg; https://uploads-ssl.webflow.com/620e15709e3fbe1a70764578/625da56cf4bba530c6f51408_%D0%90%D0%BF%D0%B0%D1%80%D1%82%20%D0%BA%D0%BB%D0%B0%D1%81%D1%81%D0%B8%D0%BA%D0%B0.jpg; https://uploads-ssl.webflow.com/620e15709e3fbe1a70764578/625da5741e463fb3d8e1ba29_living_room_vol_1_1.jpg; https://uploads-ssl.webflow.com/620e15709e3fbe1a70764578/625da579e17d8f1313f15574_EOS-Vanity-unit-Edone-by-Agora-Group-245646-rel22dbad6915.jpg,0
Дом с Атлантами,dom-s-atlantami,623d9555a6e491964c6ab9bc,623d9555a6e49190ab6aba07,Wed Mar 23 2022 16:23:29 GMT+0000 (Coordinated Universal Time),Wed Jul 13 2022 18:21:48 GMT+0000 (Coordinated Universal Time),Wed Jul 13 2022 18:35:26 GMT+0000 (Coordinated Universal Time),,taganskiy,soboleva-svetlana,0,1 878 710 ,277 980 000 ,"улица Солянка, д. 7",ЦАО,м. Китай-город,https://api-maps.yandex.ru/services/constructor/1.0/js/?um=constructor%3Ada3af1239df15e34c7313ade7819ae88882a784e42ffb060a3abab155cb68cbf&amp;width=100%25&amp;height=400&amp;lang=ru_RU&amp;scroll=true,от 79 до 313 ,19,79,313,"Дом 1882 года с богатой историей, которая продолжается","<p>«Дом с Атлантами» – это 5-ти этажный клубный дом с апартаментами и 4 таунхауса, потолками до 4,4 метра и отделкой делюкс-класса. </p><p>«Дом с Атлантами» расположен на улице Солянка в 2 минутах от парка «Зарядье» и Бульварного кольца. </p><p>Авторы реконструкции сохранили внешний облик здания — восстановили историческую кирпичную кладку, лепнину и цвет фасада, заменили перекрытия, фундамент и коммуникации. Лобби оформили натуральным камнем по авторскому проекту. </p><p>Закрытую от посторонних глаз и машин территорию оформили зелёными насаждениями и кустарниками высотой до 3 метров.</p>",Новостройки,https://uploads-ssl.webflow.com/620e15709e3fbe1a70764578/623b47bcf2ca53ed42353e6c_CAM-01-min.png,https://uploads-ssl.webflow.com/620e15709e3fbe1a70764578/623b47b860fe6847aa61bfd2_CAM-04-min.png,https://uploads-ssl.webflow.com/620e15709e3fbe1a70764578/628fe53f2e08a31d4e9b4f8f_dom%20s%20atlantami.svg,https://uploads-ssl.webflow.com/620e15709e3fbe1a70764578/623b4897f2ca5355033541d4_DSA_CL_compressed.pdf,https://uploads-ssl.webflow.com/620e15709e3fbe1a70764578/623f5c74856247735f35e13e_CAM-03-min.png; https://uploads-ssl.webflow.com/620e15709e3fbe1a70764578/623f5c74856247158435e13f_CAM-02-min.png; https://uploads-ssl.webflow.com/620e15709e3fbe1a70764578/623f5c74b3c79831c3d16606_CAM-07-min.png; https://uploads-ssl.webflow.com/620e15709e3fbe1a70764578/623f5c74c55a477d67926146_%D0%9F%D0%B5%D0%BD%D1%82%D1%85%D0%B0%D1%83%D1%81_01-min.jpg; https://uploads-ssl.webflow.com/620e15709e3fbe1a70764578/623f5c750a84bb1886f90f8b_Classic_02-min.jpg,11
Дом в Газетном переулке ,dom-v-gazetnom-pereulke,623d9555a6e491964c6ab9bc,62504490f9fc3a7f29c9299a,Fri Apr 08 2022 14:20:00 GMT+0000 (Coordinated Universal Time),Wed Jul 13 2022 18:32:56 GMT+0000 (Coordinated Universal Time),Wed Jul 13 2022 18:35:26 GMT+0000 (Coordinated Universal Time),,tverskoy,soboleva-svetlana,0,1 890 000 ,123 039 000 ,"Газетный пер., д. 13/15",ЦАО,м. Охотный ряд ,https://api-maps.yandex.ru/services/constructor/1.0/js/?um=constructor%3A0a57a58465d94e635c403ae2fd6ae200c86f822e5ed65f20732518023996c91e&amp;width=100%25&amp;height=400&amp;lang=ru_RU&amp;scroll=true,От 58 до 620,24,58,620,"Расположен в тихом Газетном переулке, в 5 минутах пешком от метро «Охотный ряд». ","<p>«Дом в Газетном переулке» — реконструированный пятиэтажный клубный дом на 24 апартамента без отделки. </p><p>Он расположен в тихом Газетном переулке, в 5 минутах пешком от метро «Охотный ряд». </p><p>Фасад дома в неоклассическом стиле изгибается в форме волны. </p><p>Окна в пол украшены коваными перилами французских балконов. </p><p>Парадный вход обрамляют колонны и элементы старых газет. </p><p>В клубном доме можно выбрать апартаменты с видом на тихую улицу или сквер. </p><p>Для тех, кто любит приватность, приготовили роскошный многоуровневый таунхаус. </p><p>Любители видов могут выбрать один из двух пентхаусов — на террасах можно создать цветущий сад. </p><p>Спланирован подземный паркинг для 25 машин и гостевая парковка.</p><p>апартаменты и таунхаусы с ценой по запросу.</p>",Новостройки,https://uploads-ssl.webflow.com/620e15709e3fbe1a70764578/6250442dddf122f446e2cd20_GAZ_Final_Cam11_1%20(1)-min.jpg,https://uploads-ssl.webflow.com/620e15709e3fbe1a70764578/625044328c23f0395b6f1014_GAZ_Final_Cam3_2-min.jpg,https://uploads-ssl.webflow.com/620e15709e3fbe1a70764578/629868792516a21021a53d46_%D0%93%D0%B0%D0%B7%D0%B5%D1%82%D0%BD%D1%8B%D0%B9%2013_15.svg,,https://uploads-ssl.webflow.com/620e15709e3fbe1a70764578/625044328c23f0395b6f1014_GAZ_Final_Cam3_2-min.jpg; https://uploads-ssl.webflow.com/620e15709e3fbe1a70764578/62504442c54e6bfceb42853f_GAZ_Final_Cam10_1-min.jpg; https://uploads-ssl.webflow.com/620e15709e3fbe1a70764578/62504442e2431918f9056dd2_GAZ_Final_Cam4_2-min.jpg; https://uploads-ssl.webflow.com/620e15709e3fbe1a70764578/62504440c98f42666bc9fd6f_GAZ_Final_Cam9_1-min.jpg; https://uploads-ssl.webflow.com/620e15709e3fbe1a70764578/6250443f049496f2e75767c7_GZ_Preview_Cam5-min.jpg,
Eleven ,eleven,623d9555a6e491964c6ab9bc,624fe49ec7a3b9e4db779af1,Fri Apr 08 2022 07:30:38 GMT+0000 (Coordinated Universal Time),Wed Jul 13 2022 18:30:25 GMT+0000 (Coordinated Universal Time),Wed Jul 13 2022 18:35:26 GMT+0000 (Coordinated Universal Time),Элевен,presnenskiy,soboleva-svetlana,0,991 912 ,72 429 426,"Звенигородское ш., д. 11",ЦАО,м. Улица 1905 года,https://api-maps.yandex.ru/services/constructor/1.0/js/?um=constructor%3A4b93dacc940da82c57d42f20698fd6d28e7950fe39c89825e2bbb2953a2bb9aa&amp;width=100%25&amp;height=400&amp;lang=ru_RU&amp;scroll=true,от 65 до 274,90,65,274,"ELEVEN знает, что главное в жизни — это не вещи. Уделяйте время главному: семье, детям и здоровью, не покидая дома.","<p>«Eleven» — комплекс &nbsp;премиум-класса на 90 квартир </p><p>Просторное лобби с потолками до 7-ми метров. Квартиры с готовой отделкой «под ключ» от итальянского дизайнера Роберто Сантоло. </p><p>Окна в пол без перегородок стирают границы и открывают панорамные виды на Москву. </p><p>А room-сервис поможет снять с вас хлопоты по дому и обеспечить максимальный комфорт. Приватная территория с зеленой гостиной-амфитеатром создает атмосферу домашнего уюта и спокойствия. </p><p>В стилобатной части комплекса предусмотрели все для удобства жильцов: фитнес-центр с бассейном и SPA-комплексом, экомаркет, ресторан и детский клуб.</p><p>‍</p>",Новостройки,https://uploads-ssl.webflow.com/620e15709e3fbe1a70764578/624fe3de1db07402777ff4a0_%D0%B2%D0%B8%D0%B401-min.jpeg,https://uploads-ssl.webflow.com/620e15709e3fbe1a70764578/624fe3e6d2dfd4782b7dcbe2_%D0%B4%D0%B5%D1%82%D1%81%D0%BA%D0%B0%D1%8F%20%D0%BF%D0%BB%D0%BE%D1%89%D0%B0%D0%B4%D0%BA%D0%B0-min.jpg,https://uploads-ssl.webflow.com/620e15709e3fbe1a70764578/628e06011021704c8b2d8eb6_11_%D0%94%D0%BE%D0%BC%20%D0%BD%D0%B0%20%D0%BF%D1%80%D0%B5%D1%81%D0%BD%D0%B5.svg,https://uploads-ssl.webflow.com/620e15709e3fbe1a70764578/624fe3253d0e091cdadf5e2d_Eleven_%D0%BF%D1%80%D0%B5%D0%B7%D0%B5%D0%BD%D1%82%D0%B0%D1%86%D0%B8%D1%8F_compressed.pdf,https://uploads-ssl.webflow.com/620e15709e3fbe1a70764578/624fe4601fb6423a78eb6f6f_%D0%B2%D0%B8%D0%B4%D1%8B%2001-min.jpg; https://uploads-ssl.webflow.com/620e15709e3fbe1a70764578/624fe46279448671dc27fb85_%D0%92%D0%B8%D0%B4%20%D1%81%D0%B2%D0%B5%D1%80%D1%85%D1%83%20(%D0%BF%D1%80%D0%B5%D0%B2%D1%8C%D1%8E)-min.JPG; https://uploads-ssl.webflow.com/620e15709e3fbe1a70764578/624fe45fc788e55e7f455455_%D0%A4%D0%B0%D1%81%D0%B0%D0%B4-%D0%BF%D0%B0%D1%80%D0%BA%D0%B8%D0%BD%D0%B3%20(%D0%BF%D1%80%D0%B5%D0%B2%D1%8C%D1%8E)-min.JPG; https://uploads-ssl.webflow.com/620e15709e3fbe1a70764578/624fe461c8230f244d09c8a5_%D0%B2%D0%B8%D0%B4%20%D1%81%20%D1%82%D0%B5%D1%80%D1%80%D0%B0%D1%81%D1%8B-min.jpg; https://uploads-ssl.webflow.com/620e15709e3fbe1a70764578/624fe460fb8c8b23313df16a_%D0%90%D0%BC%D1%84%D0%B8%D1%82%D0%B5%D0%B0%D1%82%D1%80-min.jpg,
