High Garden,high-garden,623d9555a6e491964c6ab9bc,625de73ae352dcc05bbe566b,Mon Apr 18 2022 22:33:30 GMT+0000 (Coordinated Universal Time),Wed Jul 13 2022 18:33:56 GMT+0000 (Coordinated Universal Time),Wed Jul 13 2022 18:35:26 GMT+0000 (Coordinated Universal Time),Хай гарден,hamovniki,soboleva-svetlana,,1 800 000 ,142 200 000 ,"2-й Неопалимовский переулок, д. 3",ЦАО,м. Парк Культуры,https://api-maps.yandex.ru/services/constructor/1.0/js/?um=constructor%3Af700f5e2ac8a57532deb450700ed9572645355dbeb4ab4a579e5246f67ba71a8&amp;width=100%25&amp;height=400&amp;lang=ru_RU&amp;scroll=true,от 79 до 220,15,79,220,High Garden – Клубный особняк в Хамовниках,"<p>High Garden — клубный малоквартирный жилой дом в Хамовниках, который возводится на месте бывшего доходного дома Черникова. Прекрасное7-этажное здание будет построено по проекту коллаборации бюро «Цимайло, Ляшенкои партнеры» и Kleinwelt architekten в классическом стиле и гармонично встанет в статный ряд историческиx особняков района Плющии. Фасады планируется выполнить из натурального камня. Проект рассчитан на 39 квартир площадью от 73 до 259 кв. м. Во внутреннем дворе, куда обращены окна всеx спален, будет высажен великолепный сад. Для автомобилистов предусмотрен подземный паркинг.</p><p>Комплекс расположен во 2-ом Неопалимовском переулке, в нескольких минутах ходьбы от сквера Девичьего поля. Ближайшее окружение ЖК составляют посольства Саудовской Аравии, Непала и Йемена, Министерство юстиции Российской Федерации и музей Павла Флоренского. В 10 минутах ходьбы находится Саввинская набережная, проходящая вдоль левого берега Москвы-реки.</p>",Новостройки,https://uploads-ssl.webflow.com/620e15709e3fbe1a70764578/625de719be289a79074251a9_7920184515501467.jpg,https://uploads-ssl.webflow.com/620e15709e3fbe1a70764578/625de71f308a594296413747_84820184515521457.jpg,https://uploads-ssl.webflow.com/620e15709e3fbe1a70764578/628e04a660cc52fee20b810e_Hihg%20Garden.svg,,https://uploads-ssl.webflow.com/620e15709e3fbe1a70764578/625de72b280ab00071515a8d_6072018451550144.jpg; https://uploads-ssl.webflow.com/620e15709e3fbe1a70764578/625de71f308a594296413747_84820184515521457.jpg; https://uploads-ssl.webflow.com/620e15709e3fbe1a70764578/625de729be289ae91642550b_449201845155013738.jpg; https://uploads-ssl.webflow.com/620e15709e3fbe1a70764578/625de72a8ef6ca58ca841d85_53920211118134246254.jpg; https://uploads-ssl.webflow.com/620e15709e3fbe1a70764578/625de72ae3ba107d2b7883af_89220211118134246894.jpg,
Il Ricco,il-rikko,623d9555a6e491964c6ab9bc,629104c3694a31032609357c,Fri May 27 2022 17:05:07 GMT+0000 (Coordinated Universal Time),Wed Oct 05 2022 09:25:27 GMT+0000 (Coordinated Universal Time),Wed Oct 05 2022 09:26:03 GMT+0000 (Coordinated Universal Time),Иль Рикко ,basmannyy,soboleva-svetlana,0,620 000 ,72 292 000 ,Подсосенский пер. 11,ЦАО,м. Курская ,https://api-maps.yandex.ru/services/constructor/1.0/js/?um=constructor%3A54ec162105d039e91c3b9da519896785b1c482fd68e57bfe20a01d29e6bf1135&amp;width=100%25&amp;height=400&amp;lang=ru_RU&amp;scroll=true,от 116 до 125,2,116,125,"Особняк il Ricco - это клубный дом в тихом центре Москвы, свободном от людских потоков","<p>Это особняк с историей построенный АлександромПоповым в конце 19 века в стиле русского барокко. При реновации были сохраненыисторические стены здания, по фотографиям и чертежам воссоздан его изначальныйоблик, богато украшенный чугунным литьем и барельефами.</p><p>Небесно-голубое здание - редкая жемчужина вмосковской коллекции шедевров. Оно соединяет в себе века и эпохи: богатоеаристократическое прошлое и технологичное функциональное будущее. Дом наполненультрасовременными коммуникациями и сервисами, для его строительства и отделкииспользованы материалы премиального класса.</p><p>Особняк рассчитан всего на 11 апартаментовплощадью от 76 до 207 кв. м. с возможностью их объединения. На цокольном этаже здания планируется организоватьвинные погреба и кладовые.</p><p>Премиальный уровень дома предусматривает наличиесобственных сервисов, начиная от благоустройства придомовой территории итехнического надзора, заканчивая круглосуточной консьерж-службой, котораяоказывает услуги по уборке апартаментов, выгулу питомцев, доставке продуктов,выполнению персональных поручений.</p>",Новостройки,https://uploads-ssl.webflow.com/620e15709e3fbe1a70764578/629104868d56b90d8e7fa230_1072020929162513804.jpg,https://uploads-ssl.webflow.com/620e15709e3fbe1a70764578/6291048a8d56b9ebe77fa235_6922020929162512509.jpg,https://uploads-ssl.webflow.com/620e15709e3fbe1a70764578/62910577eab3717a1de0c86a_ILL%20RICCO.svg,https://uploads-ssl.webflow.com/620e15709e3fbe1a70764578/6291047a5e858672d5f03e35_ILL%20RICCO_prezent%20_removed.pdf,https://uploads-ssl.webflow.com/620e15709e3fbe1a70764578/62910491e54bf023cad4788d_61202092916251583.jpg; https://uploads-ssl.webflow.com/620e15709e3fbe1a70764578/629104868d56b90d8e7fa230_1072020929162513804.jpg; https://uploads-ssl.webflow.com/620e15709e3fbe1a70764578/6291048a8d56b9ebe77fa235_6922020929162512509.jpg; https://uploads-ssl.webflow.com/620e15709e3fbe1a70764578/629104929fae2a8995ef1bc8_7802017626181418166.jpg; https://uploads-ssl.webflow.com/620e15709e3fbe1a70764578/62910492bcc6166f539dfd3c_9172020929162526285.jpg,
Kazakov Grand Loft,kazakov-grand-loft,623d9555a6e491964c6ab9bc,624fe82ac053b11bb4d696a5,Fri Apr 08 2022 07:45:46 GMT+0000 (Coordinated Universal Time),Wed May 25 2022 10:28:46 GMT+0000 (Coordinated Universal Time),Wed May 25 2022 11:25:42 GMT+0000 (Coordinated Universal Time),Казанов,basmannyy,soboleva-svetlana,0,631 000,16 799 400,"ул. Казакова, вл7",ЦАО,м. Курская,https://api-maps.yandex.ru/services/constructor/1.0/js/?um=constructor%3Ae3a7bff37a3ca1189e47a189600db4658b4b673c52a19eecbf8b13c28dd4482b&amp;width=100%25&amp;height=400&amp;lang=ru_RU&amp;scroll=true,От 21 до 129,283,21,129,В Kazakov Grand Loft вы сами задаете необходимый уровень личного удобства,"<p>Проект «Kazakov Grand Loft» представляет собой жилой дом высотой 11 этажей. Фасады комплекса облицованы клинкерным кирпичом ручной формовки терракотового, кофейного и серого оттенков. </p><p>Всего запроектировано 283 апартамента и более 100 планировочных решений. Все лофты выполнены в формате евро-планировки, и сдаются без отделки, с под чистовой и чистовой отделкой. &nbsp;Высота потолков в апартаментах варьируется от 3,62 до 5,11 м. Предусмотрено широкоформатное остекление.</p><p>Территория комплекса благоустроена и закрыта от машин и случайных прохожих. Для автовладельцев предусмотрен подземный паркинг на 129 мест. Для удобства жителей работает круглосуточная консьерж-служба.</p><p>ЖК «Kazakov Grand Loft» расположен в Басманном районе с развитой инфраструктурой. В пешей доступности действуют супермаркеты, культурный центр «Новый Акрополь», детские сады, фитнес-клуб, школа, университет геодезии и картографии, торгово-развлекательный центр. В 5 минутах пешком находится городская усадьба А. Разумовского, сад культуры и отдыха им. Баумана. </p><p>‍</p>",Новостройки,https://uploads-ssl.webflow.com/620e15709e3fbe1a70764578/624fe74c0f05b8c722c5cd0f_073744a45194e76c9d30b464a5d55204-min.jpg,https://uploads-ssl.webflow.com/620e15709e3fbe1a70764578/624fe750122574b357b6ab8b_b6249e4887344ce7c13cf0320e72228d-min.jpg,https://uploads-ssl.webflow.com/620e15709e3fbe1a70764578/628e04d4532a523712f8584d_KAZAKOV.svg,https://uploads-ssl.webflow.com/620e15709e3fbe1a70764578/624fe7c77320fa0041065e20_%D0%9F%D1%80%D0%B5%D0%B7%D0%B5%D0%BD%D1%82%D0%B0%D1%86%D0%B8%D1%8F.pdf,https://uploads-ssl.webflow.com/620e15709e3fbe1a70764578/624fe75a9edd6eb083104e68_fdd986e83dcf2fa39933b525a05632cc-min.jpg; https://uploads-ssl.webflow.com/620e15709e3fbe1a70764578/624fe7590c9d7609f5b2e6f8_7691ed7a1b95e1e2f464c45dd64a2eea-min.jpg; https://uploads-ssl.webflow.com/620e15709e3fbe1a70764578/624fe7fc82dc836198da0b0f_%D0%A1%D0%BD%D0%B8%D0%BC%D0%BE%D0%BA%20%D1%8D%D0%BA%D1%80%D0%B0%D0%BD%D0%B0%202022-04-08%20%D0%B2%2010.44.38.png; https://uploads-ssl.webflow.com/620e15709e3fbe1a70764578/624fe75aa2cd99973c159fbb_50a52d4c2126db183d05067023d3798a-min.jpg; https://uploads-ssl.webflow.com/620e15709e3fbe1a70764578/624fe75a0c9d76de65b2e701_a671dd71a5d80a16d1f47d447f44a4ef-min.jpg,
"Кузнецкий мост, 12 ",kuzneckiy-most-12,623d9555a6e491964c6ab9bc,624febdf2a16a136fe2df01e,Fri Apr 08 2022 08:01:35 GMT+0000 (Coordinated Universal Time),Wed Sep 07 2022 19:36:21 GMT+0000 (Coordinated Universal Time),Wed Sep 07 2022 19:42:24 GMT+0000 (Coordinated Universal Time),,meshchanskiy,soboleva-svetlana,0,1 525 000 ,125 675 250 ,"Кузнецкий мост, д. 12 ",ЦАО,м. Кузнецкий мост ,https://api-maps.yandex.ru/services/constructor/1.0/js/?um=constructor%3A461193a3fd4d7ab028d3e4d44c5e5f42e57dfc1aa6aca2890a94075ff5de9939&amp;width=100%25&amp;height=400&amp;lang=ru_RU&amp;scroll=true,От 35 до 250 ,61,35,250,Исторический дом XIX века после комплексной реконструкции c восстановлением фасада и внутренних элементов декора. ,"<p>Клубный дом делюкс-класса на 61 апартамент &nbsp;в историческом центре города и 10 минутах от Кремля.</p><p>Апартаменты располагаются с 3 этажа, на верхнем этаже двухуровневые пентхаусы с выходом на террасу. </p><p>Исторический дом XIX века после комплексной реконструкции c восстановлением фасада и внутренних элементов декора. </p><p>Архитектура дома в стиле итальянского ренессанса и барокко. </p><p>На первом этаже дома атриум с торговой галереей. 3 отдельные лобби в стиле арнуво и ардеко . </p><p>Предусмотрен круглосуточный консьерж-сервис на уровне 5* отелей и подземный паркинг на 42 машины.</p>",Новостройки,https://uploads-ssl.webflow.com/620e15709e3fbe1a70764578/624febbc2a16a102322defd5_%D0%A4%D0%B0%D1%81%D0%B0%D0%B4%20%D1%81%20%D1%83%D0%BB%D0%B8%D1%86%D1%8B%20%D0%9A%D1%83%D0%B7%D0%BD%D0%B5%D1%86%D0%BA%D0%B8%D0%B9%20%D0%9C%D0%BE%D1%81%D1%82%201-min.jpg,https://uploads-ssl.webflow.com/620e15709e3fbe1a70764578/624febc21d20c81fa751f594_Penthouse-min.jpg,https://uploads-ssl.webflow.com/620e15709e3fbe1a70764578/6318f2b35f54457e9adca7ed_KYZNETSKY%20MOST.svg,https://uploads-ssl.webflow.com/620e15709e3fbe1a70764578/624feb1c768876d1f3365ad4_Fact%20Sheet%20KM12_28.07.pdf,https://uploads-ssl.webflow.com/620e15709e3fbe1a70764578/624febd0c053b169c1d6bf69_%D0%A4%D0%B0%D1%81%D0%B0%D0%B4%20%D1%81%20%D1%83%D0%BB%D0%B8%D1%86%D1%8B%20%D0%9A%D1%83%D0%B7%D0%BD%D0%B5%D1%86%D0%BA%D0%B8%D0%B9%20%D0%9C%D0%BE%D1%81%D1%82-min.jpg; https://uploads-ssl.webflow.com/620e15709e3fbe1a70764578/624febd0944ab8137851f066_%D0%A4%D0%B0%D1%81%D0%B0%D0%B4%20%D1%81%20%D1%83%D0%BB%D0%B8%D1%86%D1%8B%20%D0%9A%D1%83%D0%B7%D0%BD%D0%B5%D1%86%D0%BA%D0%B8%D0%B9%20%D0%9C%D0%BE%D1%81%D1%82%202-min.jpg; https://uploads-ssl.webflow.com/620e15709e3fbe1a70764578/624febd0e42617f8f221cbbe_2_Apartment_to_terrace_FINAL-min.jpg; https://uploads-ssl.webflow.com/620e15709e3fbe1a70764578/624febcfa862c0466d9de0e9_1_Penthouse_Bedroom_1_Final-min.jpg; https://uploads-ssl.webflow.com/620e15709e3fbe1a70764578/624febd0fb05b94e11a04e11_Heritage%20lobby_1-min.jpg,12
Лаврушинский Sminex,lavrushinskiy-sminex,623d9555a6e491964c6ab9bc,623d9555a6e491fdbd6aba08,Wed Mar 23 2022 16:33:19 GMT+0000 (Coordinated Universal Time),Wed Sep 07 2022 19:25:37 GMT+0000 (Coordinated Universal Time),Wed Sep 07 2022 19:25:51 GMT+0000 (Coordinated Universal Time),,yakimanka,soboleva-svetlana,0,1 876 906,135 609 000 ,жилой комплекс Лаврушинский,ЦАО,м. Третьяковская,https://api-maps.yandex.ru/services/constructor/1.0/js/?um=constructor%3A31702d092c5dd7a1242c21337b79595ab7ecaa8e2722040bbb4376d750cc5683&amp;width=100%25&amp;height=400&amp;lang=ru_RU&amp;scroll=true,от 65 до 222,156,65,222,"В километре от Кремля, рядом с Третьяковской галереей.","<p>в километре от Кремля, рядом с Третьяковской галереей.</p><p>жилой комплекс из 3 корпусов и нескольких вилл в районе Якиманка в километре от Кремля. </p><p>Фасады напоминают бегущую волну — акцент фасаду придают угловые панорамные окна, эркеры и балконы с гнутым прозрачным ограждением. </p><p>Фасады облицованы натуральным светло-бежевым известняком и темным гранитом. </p><p>В комплексе представлены — 144 квартиры, 6 вилл с террасами и 6 уникальных пентхаусов с каминами, террасами и бассейнами. </p><p>Все квартиры сдаются без отделки и со свободной планировкой, пространство можно обустроить на свой цвет и вкус. </p><p>На приватной территории комплекса свой приватный парк площадью 1,4 гектара с ландшафтным дизайном, зонами для активных игр с детьми и занятий спортом, а также зеленым оазисом для спокойного отдыха.</p><p>квартиры и виллы от 1 270 000 рублей за м2.</p><p>Уникальная детская площадка 500 м2.</p><p>Комнаты: от 1 до 4.</p><p>Площадь от 65 до 222 м2.</p>",Новостройки,https://uploads-ssl.webflow.com/620e15709e3fbe1a70764578/623b4bbd2ffccb01e3012545_2_%D0%9E%D0%B1%D1%89%D0%B8%D0%B9%20%D0%B2%D0%B8%D0%B4%202%20(%D0%B4%D0%B2%D0%BE%D1%80)-min.png,https://uploads-ssl.webflow.com/620e15709e3fbe1a70764578/623b4bc0a42c5f3c9f95568e_21_Genplan%202-min.png,https://uploads-ssl.webflow.com/620e15709e3fbe1a70764578/6298696a959795a0cef89f9c_%D0%9B%D0%B0%D0%B2%D1%80%D1%83%D1%88%D0%B8%D0%BD%D1%81%D0%BA%D0%B8%D0%B9.svg,https://uploads-ssl.webflow.com/620e15709e3fbe1a70764578/623b4b13e924627bd9807ab5_Analiticeskaa%20prezentacia%20Lavrusinskij_compressed.pdf,https://uploads-ssl.webflow.com/620e15709e3fbe1a70764578/62515b0137585b7fdc3a6cf1_Terrasa_smallbuid-min.jpg; https://uploads-ssl.webflow.com/620e15709e3fbe1a70764578/62515b02f73e1217845f98de_%D0%9F%D1%82%D0%B8%D1%87%D0%BA%D0%B0%201%20(%D0%BD%D0%BE%D1%87%D1%8C)-min.jpg; https://uploads-ssl.webflow.com/620e15709e3fbe1a70764578/62515b017d492a4c98dc6ac5_0565-Tretyakovka_EXT_DAY_19_0037_pano_v13-min.jpg; https://uploads-ssl.webflow.com/620e15709e3fbe1a70764578/62515b01aac5a816ac37faf3_cam_50-min.jpg; https://uploads-ssl.webflow.com/620e15709e3fbe1a70764578/623f5d67c49a3620d45aea15_cam%203%20villa--min.jpg,
Lucky,lucky,623d9555a6e491964c6ab9bc,624fef4cc260811a8dcfb546,Fri Apr 08 2022 08:16:12 GMT+0000 (Coordinated Universal Time),Wed Jul 13 2022 18:23:35 GMT+0000 (Coordinated Universal Time),Wed Jul 13 2022 18:35:26 GMT+0000 (Coordinated Universal Time),Лаки,presnenskiy,soboleva-svetlana,0,940 000 ,61 917 800 ,"2-я Звенигородская ул., 12",ЦАО,м Улица 1905 года,https://api-maps.yandex.ru/services/constructor/1.0/js/?um=constructor%3Ac9feb5a21d048706ef16e74ae0b1573bd105daec595733172fb1918a92215b84&amp;width=100%25&amp;height=400&amp;lang=ru_RU&amp;scroll=true,От 45 до 420,90,45,420,"На приватной территории квартала разобьют парк и скверы, изысканный зеленый лабиринт и минималистичные газоны. ","<p>Жилой квартал из 8 башен и 10 отреставрированных исторических зданий. </p><p>Квартал на территории 4,5 гектара в Пресненском районе с удобным выездом на Звенигородское шоссе. </p><p> Квартиры &nbsp;с отделкой, &nbsp;кухней с бытовой техникой и готовыми ванными. На территории организуют пространства для работы и творчества в исторических зданиях – &nbsp;фитнес-центр с открытым бассейном, детский сад, ресторан, образовательный центр MindGym и магазины. </p><p>На приватной территории квартала разобьют &nbsp;парк и &nbsp;скверы, изысканный зеленый лабиринт и минималистичные газоны. </p><p>Предусмотрен подземный паркинг для 980 машин.</p>",Новостройки,https://uploads-ssl.webflow.com/620e15709e3fbe1a70764578/624fee75314de68ef66da6d1_Vesper_Lucky_NewHistorical-min-min.jpg,https://uploads-ssl.webflow.com/620e15709e3fbe1a70764578/624fee8175090f5b01c0bdd7_Vesper_Lucky_NIGHT_VIEWS-min.jpg,https://uploads-ssl.webflow.com/620e15709e3fbe1a70764578/629734f2f1ec1342736b25bc_Lucky.svg,https://uploads-ssl.webflow.com/620e15709e3fbe1a70764578/624fed0882dc83758cda3c79_Lucky__1905_compressed.pdf,https://uploads-ssl.webflow.com/620e15709e3fbe1a70764578/624feed12da9f46a46748d89_Vesper_Lucky_AerialB_W-min-min.jpg; https://uploads-ssl.webflow.com/620e15709e3fbe1a70764578/624fee95b7f61c3be3ada1f5_Vesper_Lucky_SPORT-min.jpg; https://uploads-ssl.webflow.com/620e15709e3fbe1a70764578/624fee95adae37af3ff7861f_Grey_bedroom%203.1-min.jpg; https://uploads-ssl.webflow.com/620e15709e3fbe1a70764578/624fee95c053b150f3d6cf60_Grey_livingroom_night%202-min.jpg; https://uploads-ssl.webflow.com/620e15709e3fbe1a70764578/624fee94f951fae7503b3fa9_1-min.jpg,9
Lumin ,lumin,623d9555a6e491964c6ab9bc,624ff39404905948605aa48f,Fri Apr 08 2022 08:34:28 GMT+0000 (Coordinated Universal Time),Wed Sep 07 2022 20:10:37 GMT+0000 (Coordinated Universal Time),Wed Sep 07 2022 20:10:59 GMT+0000 (Coordinated Universal Time),Люмин,taganskiy,soboleva-svetlana,0,910 000 ,31 304 000 ,"Славянская площадь, 2/5/4с5",ЦАО,м. Китай-город ,https://api-maps.yandex.ru/services/constructor/1.0/js/?um=constructor%3A90db38875138898e3edf02e5df74b60af91a4f65a0c9fa01e52c7ed9449c0615&amp;width=100%25&amp;height=400&amp;lang=ru_RU&amp;scroll=true,От 35 до 209,54,35,209,В пентхаусах можно установить камин и дополнить пространство террасой. ,"<p>Lumin — 8-ми этажный клубный дом премиум класса на 54 апартамента в Тверском районе. Строгие геометрические формы фасада и облицовка матовыми свето- прозрачными боксами. Дизайн лобби от Гарри Нуриева продолжает игру нежных цветов и дополняет ее переливами арт-колонны. На крыше дома обустроили приватную террасу с завораживающими видами на Москву. Апартаменты с премиум отделкой, панорамным остеклением и системой «Умный дом». </p><p>В пентхаусах можно установить камин и дополнить пространство террасой. </p><p>В пешей доступности от дома расположена вся необходимая инфраструктура — тц «ГУМ», Центральный детский магазин, большой парк «Зарядье» и Кремль.</p><p>апартаменты с ценой по запросу.</p><p>Площадь от 34, 4 до 208, 79 м2.</p>",Новостройки,https://uploads-ssl.webflow.com/620e15709e3fbe1a70764578/624ff37c2da9f482c774c37f_7bcbb64993f1bdc533bc5ce5cc495d8c-min.jpg,https://uploads-ssl.webflow.com/620e15709e3fbe1a70764578/624ff380c6bcd4ee35b93293_57a56066952743f6275e8a2ba3af5e8d-min.jpg,https://uploads-ssl.webflow.com/620e15709e3fbe1a70764578/629743aa2c75bb12ba9f7253_LUMIN%20HOUSE.svg,https://uploads-ssl.webflow.com/620e15709e3fbe1a70764578/624ff364c6bcd42b7cb93230_%D0%91%D1%83%D0%BA%D0%BB%D0%B5%D1%82%20Lumin.pdf,https://uploads-ssl.webflow.com/620e15709e3fbe1a70764578/624ff387cf4a0c617ffe3ad4_927c02cecfd99159d05af5df720603f8-min.jpg; https://uploads-ssl.webflow.com/620e15709e3fbe1a70764578/624ff387abd2521ebb774f3e_be62bedf990c8dd5c5d407d52a2cdde9-min.jpg; https://uploads-ssl.webflow.com/620e15709e3fbe1a70764578/624ff38772cb26dc4b89eab0_fc9c91cbc87209f7b538bd6e5b6b0ee5-min.jpg; https://uploads-ssl.webflow.com/620e15709e3fbe1a70764578/624ff387bc8aa7c49af0b8a7_3f58ea9d36cb05d2050e63e8cabe3d9d-min.jpg; https://uploads-ssl.webflow.com/620e15709e3fbe1a70764578/624ff387fb05b9a4eaa094ad_1e3b7a45efb5bf4905f67b469668d0c9-min.jpg,7
